judul,kategori,source,date
Bank Dunia Berupaya Salurkan Bantuan ke Afghanistan Tanpa Melalui Taliban,dunia,tempo.co,https://www.tempo.co/indeks/2021-11-30/dunia
Varian Omicron Sudah Masuk Belanda sebelum Afrika Selatan Mengumumkannya,dunia,tempo.co,https://www.tempo.co/indeks/2021-11-30/dunia
Politisi Sudan Dibebaskan Sebulan Setelah Kudeta Militer,dunia,tempo.co,https://www.tempo.co/indeks/2021-11-30/dunia
Calon Presiden Sayap Kanan Prancis Berikan Jari Tengah ke Penentangnya,dunia,tempo.co,https://www.tempo.co/indeks/2021-11-30/dunia
"Cegah Varian Omicron, Singapura Perketat Perbatasan dan Tingkatkan Tes PCR",dunia,tempo.co,https://www.tempo.co/indeks/2021-11-30/dunia
Warga Inggris Sekarang Wajib Pakai Masker ,dunia,tempo.co,https://www.tempo.co/indeks/2021-11-30/dunia
Ilhan Omar Anggota DPR Muslim AS Korban Rasisme Disebut Anggota Pasukan Jihad,dunia,tempo.co,https://www.tempo.co/indeks/2021-11-30/dunia
Partai Oposisi Selandia Baru Pilih Eks Bos Maskapai untuk Lawan Jacinda Ardern,dunia,tempo.co,https://www.tempo.co/indeks/2021-11-30/dunia
Jepang Konfirmasi Kasus Pertama Covid-19 Varian Omicron,dunia,tempo.co,https://www.tempo.co/indeks/2021-11-30/dunia
Daftar Ajang Olimpiade yang Pernah Diboikot Sebelum Olimpiade Beijing 2022,dunia,tempo.co,https://www.tempo.co/indeks/2021-11-30/dunia
"Gara-gara Pakaiannya, Perempuan Penjual Pancake di Thailand Didatangi Polisi",dunia,tempo.co,https://www.tempo.co/indeks/2021-11-30/dunia
Moderna Sebut Vaksin Covid-19 Mungkin Tidak Efektif Melawan Varian Omicron,dunia,tempo.co,https://www.tempo.co/indeks/2021-11-30/dunia
"Sidang Vonis Aung San Suu Kyi Ditunda, Tunggu Keterangan Saksi",dunia,tempo.co,https://www.tempo.co/indeks/2021-11-30/dunia
Taliban Minta Bantuan Uni Eropa Mengelola Bandara Kabul,dunia,tempo.co,https://www.tempo.co/indeks/2021-11-30/dunia
Daniel Kritenbrink: Kami Tak Meminta Orang Memilih Cina atau Amerika ,dunia,tempo.co,https://www.tempo.co/indeks/2021-11-30/dunia
"Sharbat Gula, setelah Fotonya di National Geographic Mengguncang Dunia",dunia,tempo.co,https://www.tempo.co/indeks/2021-11-30/dunia
China Janjikan 1 Miliar Dosis Vaksin Covid-19 untuk Afrika,dunia,tempo.co,https://www.tempo.co/indeks/2021-11-30/dunia
"Lawatan ke Indonesia, Asisten Menlu Amerika Ingin Ada Peningkatan Kerja Sama ",dunia,tempo.co,https://www.tempo.co/indeks/2021-11-30/dunia
"Amerika Serikat Akan Boikot Olimpiade Musim Dingin Beijing 2022, Kenapa?",dunia,tempo.co,https://www.tempo.co/indeks/2021-11-30/dunia
Putra Mahkota Jepang Sentil Media atas Liputan pada Pernikahan Putri Mako,dunia,tempo.co,https://www.tempo.co/indeks/2021-11-30/dunia
"Bangun Rumah Mirip Taj Mahal, Pria Ini Buktikan Cintanya pada Istri",dunia,tempo.co,https://www.tempo.co/indeks/2021-11-30/dunia
"2 Orang asal Afsel Positif Omicron di Sydney, Sempat Transit di Changi ",dunia,tempo.co,https://www.tempo.co/indeks/2021-11-30/dunia
Australia Tunda Buka Pintu Masuk untuk WN Asing Gara-gara Omicron,dunia,tempo.co,https://www.tempo.co/indeks/2021-11-30/dunia
"Aturan Baru Umrah, Penerima Vaksin Sinovac Wajib Karantina 3 Hari",dunia,tempo.co,https://www.tempo.co/indeks/2021-11-30/dunia
"Khawatir Varian Omicron, India Wajibkan Penumpang Pesawat Dites Covid-19",dunia,tempo.co,https://www.tempo.co/indeks/2021-11-30/dunia
Koalisi Saudi Serang Markas Houthi dan Pengawal Revolusi Iran di Yaman,dunia,tempo.co,https://www.tempo.co/indeks/2021-11-30/dunia
Biden Sebut Tak Perlu Panik Hadapi Virus Corona Varian Omicron,dunia,tempo.co,https://www.tempo.co/indeks/2021-11-30/dunia
Presiden Afrika Selatan Minta Dunia Menolak Larangan Melakukan Perjalanan,dunia,tempo.co,https://www.tempo.co/indeks/2021-11-30/dunia
Buku Baru Terbit di Vatikan Ungkap Dugaan Kekerasan pada Biarawati,dunia,tempo.co,https://www.tempo.co/indeks/2021-11-30/dunia
Koridor Perjalanan Udara Indonesia-Malaysia Tunggu Penelitian Omicron,dunia,tempo.co,https://www.tempo.co/indeks/2021-11-30/dunia
Top 3 Dunia: Mantan PM Kamboja Meninggal dan Gejala Penderita Terpapar Omicron,dunia,tempo.co,https://www.tempo.co/indeks/2021-11-30/dunia
"11 Bos Kasino Makau Ditangkap, Buka Perjudian di Cina Daratan ",dunia,tempo.co,https://www.tempo.co/indeks/2021-11-30/dunia
Bom Sisa Perang di Jerman Meledak ,dunia,tempo.co,https://www.tempo.co/indeks/2021-12-01/dunia
"Prabowo dan Menhan Cina Bertemu Secara Virtual, Ini yang Dibahas",dunia,tempo.co,https://www.tempo.co/indeks/2021-12-01/dunia
"Nigeria Temukan Omicron sejak Oktober, Sebulan sebelum Hebohkan Dunia",dunia,tempo.co,https://www.tempo.co/indeks/2021-12-01/dunia
KBRI Moskow Menggelar Festival Kopi ,dunia,tempo.co,https://www.tempo.co/indeks/2021-12-01/dunia
Kematian Akibat Covid-19 di Jerman Naik ,dunia,tempo.co,https://www.tempo.co/indeks/2021-12-01/dunia
Perwakilan Myanmar dan Afghanistan Diprediksi Tak Diizinkan Masuk PBB,dunia,tempo.co,https://www.tempo.co/indeks/2021-12-01/dunia
Kedutaan India Luncurkan Buku 'Kesamaan - India Indonesia; The Next Step',dunia,tempo.co,https://www.tempo.co/indeks/2021-12-01/dunia
Shinzo Abe: Jepang dan AS Tak Akan Diam Jika Taiwan Diserang China,dunia,tempo.co,https://www.tempo.co/indeks/2021-12-01/dunia
"Hong Kong Kekurangan Pegawai, Ekspatriat Ramai-ramai Keluar Selama Pandemi ",dunia,tempo.co,https://www.tempo.co/indeks/2021-12-01/dunia
Rihanna Dinobatkan Jadi Pahlawan Nasional Barbados,dunia,tempo.co,https://www.tempo.co/indeks/2021-12-01/dunia
Calon Presiden Pilihan Duterte Mundur dari Pilpres Filipina,dunia,tempo.co,https://www.tempo.co/indeks/2021-12-01/dunia
"Barbados Resmi Jadi Republik, Copot Ratu Elizabeth II Sebagai Kepala Negara",dunia,tempo.co,https://www.tempo.co/indeks/2021-12-01/dunia
"Helikopter Militer Azerbaijan Jatuh Saat Latihan, 14 Prajurit Tewas  ",dunia,tempo.co,https://www.tempo.co/indeks/2021-12-01/dunia
Eks Ratu Kecantikan AS Divonis 3 Tahun Penjara karena Bantu Suami Raja Narkoba,dunia,tempo.co,https://www.tempo.co/indeks/2021-12-01/dunia
Perdana Menteri Ukraina Tuduh Rusia Rencanakan Plot Kudeta,dunia,tempo.co,https://www.tempo.co/indeks/2021-12-01/dunia
Washington Tidak Akan Paksa Asean Berpihak ke AS atau Cina,dunia,tempo.co,https://www.tempo.co/indeks/2021-12-01/dunia
"3 Tewas dalam Penembakan di Amerika, Pelaku Masih Berusia 15 Tahun ",dunia,tempo.co,https://www.tempo.co/indeks/2021-12-01/dunia
"Hadapi Varian Omicron, Inggris Terapkan Wajib Masker dan Kejar Program Booster",dunia,tempo.co,https://www.tempo.co/indeks/2021-12-01/dunia
Kisah Sedih Kasta Terendah India: Dilecehkan di Kampus meski Berprestasi,dunia,tempo.co,https://www.tempo.co/indeks/2021-12-01/dunia
Satu dari Tiga Orang yang Bekerja di Parlemen Australia Alami Pelecehan Seksual,dunia,tempo.co,https://www.tempo.co/indeks/2021-12-01/dunia
Top 3 Dunia: Viral Penjual Pancake di Thailand hingga Evakuasi Sharbat Gula,dunia,tempo.co,https://www.tempo.co/indeks/2021-12-01/dunia
Awal Mula Ditetapkan Hari AIDS Sedunia pada 1 Desember Hari Ini ,dunia,tempo.co,https://www.tempo.co/indeks/2021-12-01/dunia
Kasus Varian Omicron Terdeteksi di India ,dunia,tempo.co,https://www.tempo.co/indeks/2021-12-02/dunia
Mantan Kanselir Austria Sebastian Kurz Menyatakan Keluar dari Politik ,dunia,tempo.co,https://www.tempo.co/indeks/2021-12-02/dunia
Jepang Cabut Larangan Reservasi Penerbangan Setelah Dihujani Kritik,dunia,tempo.co,https://www.tempo.co/indeks/2021-12-02/dunia
Otoritas Kesehatan Sarankan Belanda Wajibkan Penumpang Tes Covid-19 ,dunia,tempo.co,https://www.tempo.co/indeks/2021-12-02/dunia
"Elon Musk Email Karyawan, Sebut SpaceX Terancam Bangkrut",dunia,tempo.co,https://www.tempo.co/indeks/2021-12-02/dunia
"Viral di Tiktok, Pasutri Naik Motor Bebek dari Malaysia ke Paris",dunia,tempo.co,https://www.tempo.co/indeks/2021-12-02/dunia
"Ada Varian Omicron, Inggris Beli 114 Juta Dosis Vaksin Virus Corona ",dunia,tempo.co,https://www.tempo.co/indeks/2021-12-02/dunia
Hun Sen Dukung Putra Sulungnya Jadi Perdana Menteri Kamboja,dunia,tempo.co,https://www.tempo.co/indeks/2021-12-02/dunia
"Kasus Omicron di Australia Bertambah Jadi 7 Orang, Waspadai Penularan di Pesawat",dunia,tempo.co,https://www.tempo.co/indeks/2021-12-02/dunia
Amerika Serikat Prihatin Nasib Wartawan dan Aktivis di Guatemala ,dunia,tempo.co,https://www.tempo.co/indeks/2021-12-02/dunia
"Pulang dari Afrika, Suami Istri Korea Selatan Ini Tularkan Omicron ke Keluarga ",dunia,tempo.co,https://www.tempo.co/indeks/2021-12-02/dunia
Kasus Pertama Omicron Terdeteksi di Nigeria,dunia,tempo.co,https://www.tempo.co/indeks/2021-12-02/dunia
"3 Fakta Soal Barbados, Negara Jajahan Inggris yang Resmi Jadi Republik",dunia,tempo.co,https://www.tempo.co/indeks/2021-12-02/dunia
Joe Biden Akan Wajibkan Masker di Transportasi Umum karena Varian Omicron,dunia,tempo.co,https://www.tempo.co/indeks/2021-12-02/dunia
Negara-negara yang Memperketat Perbatasannya karena Varian Omicron,dunia,tempo.co,https://www.tempo.co/indeks/2021-12-02/dunia
"Tersulut Ucapan Abe, Beijing Panggil Duta Besar Jepang untuk Cina ",dunia,tempo.co,https://www.tempo.co/indeks/2021-12-02/dunia
Amerika Serikat dan Cina Terlibat dalam Perlombaan Senjata Hipersonik,dunia,tempo.co,https://www.tempo.co/indeks/2021-12-02/dunia
Amerika Identifikasi Kasus Varian Omicron pada Pelancong yang sudah Divaksin,dunia,tempo.co,https://www.tempo.co/indeks/2021-12-02/dunia
Donald Trump Dites Positif Covid-19 Tiga Hari Sebelum Debat dengan Joe Biden,dunia,tempo.co,https://www.tempo.co/indeks/2021-12-02/dunia
"Hadapi Pengaruh Cina, Angkatan Darat AS Cari Akses Pangkalan di Asia Tenggara",dunia,tempo.co,https://www.tempo.co/indeks/2021-12-02/dunia
PBB Tunda Pemberian Kredensial ke Afghanistan dan Myanmar,dunia,tempo.co,https://www.tempo.co/indeks/2021-12-02/dunia
Arab Saudi Konfirmasi Kasus Pertama Varian Omicron Covid-19,dunia,tempo.co,https://www.tempo.co/indeks/2021-12-02/dunia
Amerika Serikat Mendeteksi Kasus Pertama Covid-19 Varian Omicron,dunia,tempo.co,https://www.tempo.co/indeks/2021-12-02/dunia
Cina Minta RI Hentikan Pengeboran Migas di Laut Natuna dan Protes Garuda Shield,dunia,tempo.co,https://www.tempo.co/indeks/2021-12-02/dunia
Top 3 Dunia: Istri Raja Narkoba Divonis Penjara dan Barbados Jadi Republik,dunia,tempo.co,https://www.tempo.co/indeks/2021-12-02/dunia
Staf Lokal Kedutaan Inggris di Berlin Jadi Mata-Mata Rusia,dunia,tempo.co,https://www.tempo.co/indeks/2021-12-03/dunia
"Baca Al Quran di Kereta London, Pria Muslim Ini Dimarahi Penumpang Lain  ",dunia,tempo.co,https://www.tempo.co/indeks/2021-12-03/dunia
" ISIS Serang Desa di Irak Utara, 13 Orang Tewas Termasuk Tentara",dunia,tempo.co,https://www.tempo.co/indeks/2021-12-03/dunia
"Temukan Lagi 2 Kasus Omicron, Swiss Langsung Karantina 2.000 Orang",dunia,tempo.co,https://www.tempo.co/indeks/2021-12-03/dunia
"Taliban Rilis Dekrit: Perempuan Bukan Properti, Tak Boleh Dinikahi Paksa",dunia,tempo.co,https://www.tempo.co/indeks/2021-12-03/dunia
"Omicron Sudah Masuk Malaysia Sejak 19 November, Dibawa Mahasiswa WN Afrika",dunia,tempo.co,https://www.tempo.co/indeks/2021-12-03/dunia
Hari ini 38 Tahun Lalu: Tragedi Bhopal India Guncang Dunia,dunia,tempo.co,https://www.tempo.co/indeks/2021-12-03/dunia
"Bos AirAsia Kritik Reaksi Berlebihan Omicron, Lebih Baik Turunkan Harga Tes PCR ",dunia,tempo.co,https://www.tempo.co/indeks/2021-12-03/dunia
Gadis Afghanistan Usia 9 Tahun yang Dijual Ayahnya Akhirnya Diselamatkan,dunia,tempo.co,https://www.tempo.co/indeks/2021-12-03/dunia
"Perjalanan Benazir Bhutto, Perdana Menteri Wanita Pertama di Negara Islam",dunia,tempo.co,https://www.tempo.co/indeks/2021-12-03/dunia
"WHO Minta Negara Asia Pasifik Waspadai Omicron, Kasus Covid-19 Bisa Melonjak ",dunia,tempo.co,https://www.tempo.co/indeks/2021-12-03/dunia
BAKN DPR RI Diskusi dengan BPK Kenya tentang Sistem Pengawasan Keuangan Negara,dunia,tempo.co,https://www.tempo.co/indeks/2021-12-03/dunia
Kasus Alec Baldwin Tembak Sutradara: Saya Tak Pernah Tarik Pelatuk Pistol,dunia,tempo.co,https://www.tempo.co/indeks/2021-12-03/dunia
Jerman Batasi Akses Orang yang Tidak Divaksin dan Mau Wajibkan Vaksinasi,dunia,tempo.co,https://www.tempo.co/indeks/2021-12-03/dunia
Pria Berpakaian Ninja Menyerang Dua Polisi Perempuan Prancis dengan Pedang,dunia,tempo.co,https://www.tempo.co/indeks/2021-12-03/dunia
"Militer Jerman Gelar Upacara Perpisahan untuk Angela Merkel, Diiringi Lagu Punk",dunia,tempo.co,https://www.tempo.co/indeks/2021-12-03/dunia
Varian Omicron Memicu Risiko Infeksi Ulang 3 Kali Lipat Dibanding Varian Lain,dunia,tempo.co,https://www.tempo.co/indeks/2021-12-03/dunia
14 Penumpang di Belanda yang Terinfeksi Varian Omicron Sudah Divaksin,dunia,tempo.co,https://www.tempo.co/indeks/2021-12-03/dunia
Novavax Akan Membuat Vaksin Covid-19 untuk Varian Omicron Mulai Januari 2022,dunia,tempo.co,https://www.tempo.co/indeks/2021-12-03/dunia
Uni Eropa Ingatkan Kasus Omicron Bakal Meledak Beberapa Bulan ke Depan,dunia,tempo.co,https://www.tempo.co/indeks/2021-12-03/dunia
"Singapura Umumkan 2 Kasus Pertama Omicron, Penumpang Pesawat dari Afrika Selatan",dunia,tempo.co,https://www.tempo.co/indeks/2021-12-03/dunia
"Top 3 Dunia: China Minta RI Stop Migas di Natuna, Trump Pernah Positif Corona ",dunia,tempo.co,https://www.tempo.co/indeks/2021-12-03/dunia
"Virus Corona, Kroasia Bakal Terapkan Denda ",dunia,tempo.co,https://www.tempo.co/indeks/2021-12-03/dunia
Warga Belanda Unjuk Rasa Memprotes Pengetatan Aturan Covid-19,dunia,tempo.co,https://www.tempo.co/indeks/2021-12-04/dunia
Swiss International Air Lines Hentikan Sementara Penerbangan ke Hong Kong ,dunia,tempo.co,https://www.tempo.co/indeks/2021-12-04/dunia
Militan Tembak Mati 38 Warga Sipil dan Tentara di Mali dan Nigeria,dunia,tempo.co,https://www.tempo.co/indeks/2021-12-04/dunia
Pengadilan Izinkan Maria Ressa ke Norwegia Terima Nobel Perdamaian,dunia,tempo.co,https://www.tempo.co/indeks/2021-12-04/dunia
Wanita Inggris Gugat Dokter Ibunya karena Ia Lahir Cacat,dunia,tempo.co,https://www.tempo.co/indeks/2021-12-04/dunia
"Genap Berusia 50 Tahun, Berikut Sederet Fakta Uni Emirat Arab",dunia,tempo.co,https://www.tempo.co/indeks/2021-12-04/dunia
"WHO Belum Temukan Kematian Akibat Omicron, Varian Delta Masih Dominan",dunia,tempo.co,https://www.tempo.co/indeks/2021-12-04/dunia
7 Provinsi di Afrika Selatan Sudah Mendeteksi Varian Omicron,dunia,tempo.co,https://www.tempo.co/indeks/2021-12-04/dunia
KBRI Nairobi Dorong UMKM Indonesia Jajaki Peluang Ekspor ke Afrika,dunia,tempo.co,https://www.tempo.co/indeks/2021-12-04/dunia
"Berusia 50 Tahun, Begini Sejarah dan Sistem Perekonomian Uni Emirat Arab",dunia,tempo.co,https://www.tempo.co/indeks/2021-12-04/dunia
Eropa Sedang Upayakan Kirim Duta Besar ke Afghanistan  ,dunia,tempo.co,https://www.tempo.co/indeks/2021-12-04/dunia
Tel Aviv Geser Paris sebagai Kota Termahal di Dunia,dunia,tempo.co,https://www.tempo.co/indeks/2021-12-04/dunia
PBB Bantu Populerkan Bahasa Isyarat di Indonesia,dunia,tempo.co,https://www.tempo.co/indeks/2021-12-04/dunia
Kereta Cepat Penghubung Laos dengan Cina Resmi Dibuka,dunia,tempo.co,https://www.tempo.co/indeks/2021-12-04/dunia
"Uang dari Cina Daratan Mengalir ke Perjudian di Makau, Beijing Berang",dunia,tempo.co,https://www.tempo.co/indeks/2021-12-04/dunia
iPhone Milik Sembilan Staf Kedubes AS di Uganda Diretas dengan Pegasus Spyware,dunia,tempo.co,https://www.tempo.co/indeks/2021-12-04/dunia
Retno Marsudi Bertelepon dengan Menteri Luar Negeri Jepang Bahas Kerja Sama ,dunia,tempo.co,https://www.tempo.co/indeks/2021-12-04/dunia
Pasukan Perlawanan Myanmar Hancurkan 400 Menara BTS yang Dikuasai Junta Militer,dunia,tempo.co,https://www.tempo.co/indeks/2021-12-04/dunia
Band Rock Voice of Baceprot dari Garut Manggung di Belgia ,dunia,tempo.co,https://www.tempo.co/indeks/2021-12-04/dunia
WHO Imbau Negara Asia-Pasifik Bersiap Hadapi Lonjakan COVID-19 Varian Omicron,dunia,tempo.co,https://www.tempo.co/indeks/2021-12-04/dunia
Indonesia Terpilih Jadi Tuan Rumah World Tourism Day 2022,dunia,tempo.co,https://www.tempo.co/indeks/2021-12-04/dunia
Manajer Pabrik di Pakistan Tewas Disiksa Massa karena Tuduhan Penistaan Agama,dunia,tempo.co,https://www.tempo.co/indeks/2021-12-04/dunia
"Taliban Terbitkan Dekrit Larangan Nikah Paksa, Apa Kata Perempuan Afghanistan?",dunia,tempo.co,https://www.tempo.co/indeks/2021-12-04/dunia
Kepala Peneliti WHO Sebut Varian Omicron Bisa Menjadi Dominan Gantikan Delta,dunia,tempo.co,https://www.tempo.co/indeks/2021-12-04/dunia
"Intip Kemewahan Kapal Pesiar Pangeran Arab Saudi, Lantai Dansa hingga Tequila",dunia,tempo.co,https://www.tempo.co/indeks/2021-12-04/dunia
Uni Emirat Arab Borong 80 Jet Tempur Rafale dari Prancis,dunia,tempo.co,https://www.tempo.co/indeks/2021-12-04/dunia
"Top 3 Dunia: Omicron Memicu Infeksi Ulang, India Temukan Kasus Pertama  ",dunia,tempo.co,https://www.tempo.co/indeks/2021-12-04/dunia
"Varian Omicron, Inggris Ketatkan Aturan Masuknya Pelancong ",dunia,tempo.co,https://www.tempo.co/indeks/2021-12-05/dunia
Putri Aiko Rayakan Masa Dewasanya,dunia,tempo.co,https://www.tempo.co/indeks/2021-12-05/dunia
"Dituduh Siapkan Serangan ke Ukraina, Rusia Buka Suara ",dunia,tempo.co,https://www.tempo.co/indeks/2021-12-05/dunia
Kasus Varian Omicron di Korea Selatan Bertambah   ,dunia,tempo.co,https://www.tempo.co/indeks/2021-12-05/dunia
"Junta Myanmar Makin Brutal, Tabrak Pengunjuk Rasa dengan Mobil Militer ",dunia,tempo.co,https://www.tempo.co/indeks/2021-12-05/dunia
Narkoba Hampir 900 Kilogram Disita Bea Cukai Thailand ,dunia,tempo.co,https://www.tempo.co/indeks/2021-12-05/dunia
"Varian Omicron, Acara Tahun Baru di Brasil Dibatalkan ",dunia,tempo.co,https://www.tempo.co/indeks/2021-12-05/dunia
14 Warga Sipil Tewas akibat Tembakan Membabi Buta Pasukan Paramiliter India,dunia,tempo.co,https://www.tempo.co/indeks/2021-12-05/dunia
Kasus Pertama Varian Omicron Terdeteksi di Chile,dunia,tempo.co,https://www.tempo.co/indeks/2021-12-05/dunia
India Batalkan Paten Varietas Kentang untuk Keripik Lay's,dunia,tempo.co,https://www.tempo.co/indeks/2021-12-05/dunia
Warga Bethlehem Berharap Libur Natal Tak Dikacaukan Omicron  ,dunia,tempo.co,https://www.tempo.co/indeks/2021-12-05/dunia
Ratu Beatrix dari Belanda Positif Covid-19,dunia,tempo.co,https://www.tempo.co/indeks/2021-12-05/dunia
Bom Ditemukan di Mobil Polisi yang Akan Mengamankan Presiden Turki,dunia,tempo.co,https://www.tempo.co/indeks/2021-12-05/dunia
Menteri Pertahanan Amerika Mengkritik Jet Tempur Cina di Dekat Taiwan ,dunia,tempo.co,https://www.tempo.co/indeks/2021-12-05/dunia
Penerbangan Sipil Diminta Ngalah Saat Pesawat NATO Melintas,dunia,tempo.co,https://www.tempo.co/indeks/2021-12-05/dunia
Pastur Gereja Ortodoks Yunani Teriaki Paus Fransiskus 'Anda Bidat',dunia,tempo.co,https://www.tempo.co/indeks/2021-12-05/dunia
Kuda Nil di Kebun Binatang Belgia Positif Covid-19,dunia,tempo.co,https://www.tempo.co/indeks/2021-12-05/dunia
"CNN Pecat Presenter Top Chris Cuomo, Beri Nasihat Kakaknya Gubernur New York",dunia,tempo.co,https://www.tempo.co/indeks/2021-12-05/dunia
Pesan Terakhir Angela Merkel sebelum Letakkan Jabatan: Ikutlah Vaksinasi ,dunia,tempo.co,https://www.tempo.co/indeks/2021-12-05/dunia
Menteri Negara Islam Bertemu di Pakistan untuk Membantu Afghanistan ,dunia,tempo.co,https://www.tempo.co/indeks/2021-12-05/dunia
"Video Murid Jumatan di Luar saat Cuaca Dingin Viral, Sekolah Inggris Minta Maaf",dunia,tempo.co,https://www.tempo.co/indeks/2021-12-05/dunia
"Salah Amputasi Kaki Pasien, Dokter Ini Dihukum Denda Rp44 Juta",dunia,tempo.co,https://www.tempo.co/indeks/2021-12-05/dunia
"Top 3 Dunia: Dari Omicron, Pasukan Perlawanan Myanmar hingga Kasino di Makau",dunia,tempo.co,https://www.tempo.co/indeks/2021-12-05/dunia
Varian Omicron Terdeteksi di Norwegia ,dunia,tempo.co,https://www.tempo.co/indeks/2021-12-05/dunia
Cina Minta Seruan Boikot Olimpiade Musim Dingin Dihentikan ,dunia,tempo.co,https://www.tempo.co/indeks/2021-12-06/dunia
"Omicron Masuk 47 Negara, Terakhir Terdeteksi di Rusia, Nepal dan Thailand",dunia,tempo.co,https://www.tempo.co/indeks/2021-12-06/dunia
"Indonesia Tak Undang Myanmar ke Bali Democracy Forum, Ini Sebabnya",dunia,tempo.co,https://www.tempo.co/indeks/2021-12-06/dunia
"Nelson Mandela, Pengagum Syekh Yusuf asal Makassar dan Batik Indonesia",dunia,tempo.co,https://www.tempo.co/indeks/2021-12-06/dunia
"Aung San Suu Kyi Dihukum 4 Tahun, Komisi HAM PBB: Pengadilan Palsu",dunia,tempo.co,https://www.tempo.co/indeks/2021-12-06/dunia
Angkatan Laut Rusia dan ASEAN Latihan Bersama di Selat Malaka ,dunia,tempo.co,https://www.tempo.co/indeks/2021-12-06/dunia
"Tabrakkan Mobil ke Pos Penjagaan Israel, Remaja Palestina Tewas Ditembak ",dunia,tempo.co,https://www.tempo.co/indeks/2021-12-06/dunia
Kasus Omicron di India Bertambah ,dunia,tempo.co,https://www.tempo.co/indeks/2021-12-06/dunia
"Nelson Mandela, 27 Tahun Berjuang Melawan Apartheid Tanpa Kekerasan",dunia,tempo.co,https://www.tempo.co/indeks/2021-12-06/dunia
Sarah Gilbert Penemu Vaksin AstraZeneca Ingatkan Covid-19 Bisa Lebih Mematikan,dunia,tempo.co,https://www.tempo.co/indeks/2021-12-06/dunia
"Menlu AS Antony Blinken Kunjungi Indonesia Pekan Depan, Ini Agendanya",dunia,tempo.co,https://www.tempo.co/indeks/2021-12-06/dunia
Afrika Selatan Siap-siap Hadapi Lonjakan Pasien Covid-19,dunia,tempo.co,https://www.tempo.co/indeks/2021-12-06/dunia
Mohammed bin Salman Lawatan ke Negara Teluk ,dunia,tempo.co,https://www.tempo.co/indeks/2021-12-06/dunia
Aung San Suu Kyi Divonis 4 Tahun dalam Kasus Pelanggaran Protokol Covid-19,dunia,tempo.co,https://www.tempo.co/indeks/2021-12-06/dunia
PM Kamboja Usulkan Pemimpin Junta Myanmar Diundang ke KTT ASEAN,dunia,tempo.co,https://www.tempo.co/indeks/2021-12-06/dunia
Adama Barrow Terpilih Lagi Jadi Presiden Gambia,dunia,tempo.co,https://www.tempo.co/indeks/2021-12-06/dunia
"Terjebak Badai Salju, Puluhan Orang Terpaksa Menginap di Toko IKEA",dunia,tempo.co,https://www.tempo.co/indeks/2021-12-06/dunia
"Arab Saudi Kucurkan Pinjaman ke Pakistan Rp 43,5 Triliun",dunia,tempo.co,https://www.tempo.co/indeks/2021-12-06/dunia
"10 Pasien Covid-19 Meninggal Kekurangan Oksigen, Dirut RS Dipenjara 3 Tahun ",dunia,tempo.co,https://www.tempo.co/indeks/2021-12-06/dunia
Arab Saudi Terima Turis Asing yang Divaksin Sputnik V Mulai 1 Januari,dunia,tempo.co,https://www.tempo.co/indeks/2021-12-06/dunia
"Omicron Makin Merajalela, Ditemukan di Sepertiga Wilayah Amerika Serikat",dunia,tempo.co,https://www.tempo.co/indeks/2021-12-06/dunia
Unjuk Rasa di Belgia Memprotes Aturan Covid-19 Berakhir Ricuh,dunia,tempo.co,https://www.tempo.co/indeks/2021-12-06/dunia
"Angkut Ribuan Penumpang, 10 Orang di Kapal Pesiar Norwegia Positif Corona",dunia,tempo.co,https://www.tempo.co/indeks/2021-12-06/dunia
Jerman Ingin Buat Aturan Wajib Imunisasi Vaksin Virus Corona ,dunia,tempo.co,https://www.tempo.co/indeks/2021-12-06/dunia
"Aung San Suu Kyi Dijerat Selusin Tuduhan, Sidang Vonis Digelar Hari ini",dunia,tempo.co,https://www.tempo.co/indeks/2021-12-06/dunia
"Krisis Ukraina Memanas, Biden dan Putin Bertemu Secara Virtual Besok",dunia,tempo.co,https://www.tempo.co/indeks/2021-12-06/dunia
"Demi Sertifikat, Dokter Gigi Ini Sodorkan Lengan Palsu Saat Divaksin Corona",dunia,tempo.co,https://www.tempo.co/indeks/2021-12-06/dunia
"Entah Apa Maksudnya, Anggota DPR Unggah Foto Natal sambil Bawa Senjata",dunia,tempo.co,https://www.tempo.co/indeks/2021-12-06/dunia
"Kamp PBB di Mali Diguncang Bom, Pelaku Belum Diketahui",dunia,tempo.co,https://www.tempo.co/indeks/2021-12-06/dunia
Presiden Cina Perintahkan Aparat dan Kader Partai Pahami Urusan Keagamaan,dunia,tempo.co,https://www.tempo.co/indeks/2021-12-06/dunia
"Top 3 Dunia: Paus Diteriaki Bidat, Murid Jumatan di Luar saat Cuaca Dingin",dunia,tempo.co,https://www.tempo.co/indeks/2021-12-06/dunia
Cina: Amerika akan Terima Balasan karena Boikot Olimpiade Beijing 2022,dunia,tempo.co,https://www.tempo.co/indeks/2021-12-07/dunia
GSK Klaim Obatnya Efektif terhadap Semua Mutasi Virus Corona Varian Omicron,dunia,tempo.co,https://www.tempo.co/indeks/2021-12-07/dunia
"Cerita WNI Jadi Perawat Covid-19 di Belanda: Rumah Sakit Penuh, Kurang Nakes",dunia,tempo.co,https://www.tempo.co/indeks/2021-12-07/dunia
Studi: Campuran Ketiga Vaksin Covid-19 Ini Lebih Efektif Tangkal Corona ,dunia,tempo.co,https://www.tempo.co/indeks/2021-12-07/dunia
Serangan Udara Israel Membakar Pelabuhan Latakia di Suriah,dunia,tempo.co,https://www.tempo.co/indeks/2021-12-07/dunia
Kamboja Terima Menlu Junta Myanmar di Tengah Sorotan Dunia pada Hukuman Suu Kyi,dunia,tempo.co,https://www.tempo.co/indeks/2021-12-07/dunia
"Diizinkan Taliban, Adu Gulat Jadi Hiburan Pria Afghanistan",dunia,tempo.co,https://www.tempo.co/indeks/2021-12-07/dunia
Joe Biden Mau Sanksi Bank Terbesar Rusia Jika Putin Menyerang Ukraina,dunia,tempo.co,https://www.tempo.co/indeks/2021-12-07/dunia
Makam Ulama Nusantara Sayed Abdul Malik Jadi Warisan Budaya di Afrika Selatan,dunia,tempo.co,https://www.tempo.co/indeks/2021-12-07/dunia
Putri Amalia Kerajaan Belanda Rayakan Ulang Tahun ke-18 secara Sederhana,dunia,tempo.co,https://www.tempo.co/indeks/2021-12-07/dunia
"Miliuner Michael Steinhardt Serahkan Barang Antik Rp 1 Triliun, Diduga Curian ",dunia,tempo.co,https://www.tempo.co/indeks/2021-12-07/dunia
"Mengerikan, Mesin Bunuh Diri Resmi Boleh Digunakan di Swiss ",dunia,tempo.co,https://www.tempo.co/indeks/2021-12-07/dunia
"Adopsi Anjing Liar Berdasarkan Astrologi, Ini Caranya ",dunia,tempo.co,https://www.tempo.co/indeks/2021-12-07/dunia
"Madame Tussauds, 33 Tahun Keliling Inggris Sebelum Mendirikan Museum Lilin",dunia,tempo.co,https://www.tempo.co/indeks/2021-12-07/dunia
"Teken Kesepakatan Senjata, India Akan Produksi 600.000 Pucuk Kalashnikov AK-203",dunia,tempo.co,https://www.tempo.co/indeks/2021-12-07/dunia
"Pria China Ini Nikahi Lagi Eks Istri yang Sakit Keras, Alasannya Bikin Terharu  ",dunia,tempo.co,https://www.tempo.co/indeks/2021-12-07/dunia
Pria Palestina Gugat Menhan Israel ke Pengadilan Belanda atas Kejahatan Perang,dunia,tempo.co,https://www.tempo.co/indeks/2021-12-07/dunia
