judul,kategori,source,date
"ISIS Klaim Bertanggung Jawab dalam Serangan di Desa Kongo, 16 Warga Tewas",dunia,tempo.co,https://www.tempo.co/indeks/2021-10-23/dunia
Swedia Prihatin Ekonomi Afghanistan Menuju Kelumpuhan,dunia,tempo.co,https://www.tempo.co/indeks/2021-10-23/dunia
"Ajaib, Jivunben Rabari Wanita India Berusia 70 Tahun Melahirkan Bayi Laki-laki",dunia,tempo.co,https://www.tempo.co/indeks/2021-10-23/dunia
"Melbourne Buka Lockdown Terlama di Dunia, Jalanan Penuh di ",dunia,tempo.co,https://www.tempo.co/indeks/2021-10-23/dunia
Rusia dan Cina Lakukan Patroli Bersama di Pasifik,dunia,tempo.co,https://www.tempo.co/indeks/2021-10-23/dunia
"Covid-19 Naik, Sekolah Tatap Muka di Ukraina Diminta Tutup ",dunia,tempo.co,https://www.tempo.co/indeks/2021-10-23/dunia
"Polisi Tangkap Pria, Diduga Terkait Bom Bunuh Diri di Konser Ariana Grande 2017",dunia,tempo.co,https://www.tempo.co/indeks/2021-10-23/dunia
WHO Susun Rencana Agar Pelecehan Seksual di Kongo Tak Terulang,dunia,tempo.co,https://www.tempo.co/indeks/2021-10-23/dunia
Pistol Alec Baldwin Berisi Peluru Tajam,dunia,tempo.co,https://www.tempo.co/indeks/2021-10-23/dunia
Warga Tunisia Harus Imunisasi Vaksin Virus Corona Jika Mau Akses Fasilitas Umum,dunia,tempo.co,https://www.tempo.co/indeks/2021-10-23/dunia
Unjuk Rasa Sopir Truk di Brasil Mengganggu Suplai Bahan Bakar,dunia,tempo.co,https://www.tempo.co/indeks/2021-10-23/dunia
"Kamp Pengungsi Etnis Rohingya di Cox Bazaar Diserang, 6 Tewas ",dunia,tempo.co,https://www.tempo.co/indeks/2021-10-23/dunia
Serangan Drone AS Tewaskan Pimpinan  Al-Qaeda di Suriah,dunia,tempo.co,https://www.tempo.co/indeks/2021-10-23/dunia
Cina Sahkan Undang-Undang Larang Banyak PR dan Bimbel di Akhir Pekan,dunia,tempo.co,https://www.tempo.co/indeks/2021-10-23/dunia
Putri Mako Rayakan Ulang Tahun Terakhir Sebagai Anggota Kekaisaran Jepang,dunia,tempo.co,https://www.tempo.co/indeks/2021-10-23/dunia
Angela Merkel Dukung Perempuan Berpolitik,dunia,tempo.co,https://www.tempo.co/indeks/2021-10-23/dunia
"Kronologi Tewasnya Blogger Gabby Petito dan Pacarnya, Pelakunya Masih Misterius",dunia,tempo.co,https://www.tempo.co/indeks/2021-10-23/dunia
Barbados Akhirnya Punya Presiden Sendiri setelah 55 Tahun Merdeka,dunia,tempo.co,https://www.tempo.co/indeks/2021-10-23/dunia
"Kasus Covid-19 Naik, Menteri Keuangan Tak Mau Inggris Lockdown Lagi ",dunia,tempo.co,https://www.tempo.co/indeks/2021-10-23/dunia
"Ditolak oleh ASEAN, Junta Myanmar Klaim Berhak Ikut KTT 26 Oktober",dunia,tempo.co,https://www.tempo.co/indeks/2021-10-23/dunia
Israel Menunjuk Enam Kelompok Sipil Palestina Sebagai Organisasi Teroris,dunia,tempo.co,https://www.tempo.co/indeks/2021-10-23/dunia
"Cina Optimistis Investasi Asing Tahun Ini Capai Rp2,2 Kuadriliun ",dunia,tempo.co,https://www.tempo.co/indeks/2021-10-23/dunia
Efikasi Vaksin Pfizer 90 Persen dalam Uji Klinis Anak-anak Usia 5-11 Tahun,dunia,tempo.co,https://www.tempo.co/indeks/2021-10-23/dunia
Top 3 Dunia: Malaysia Usul Jembatan Malaka Hingga Tewasnya Blogger Gabby Petito,dunia,tempo.co,https://www.tempo.co/indeks/2021-10-23/dunia
Myanmar Janji Mau Kerja Sama dengan ASEAN,dunia,tempo.co,https://www.tempo.co/indeks/2021-10-24/dunia
Inggris Ingin Hindari Lockdown Walau Kasus Baru Covid-19 Naik Lagi,dunia,tempo.co,https://www.tempo.co/indeks/2021-10-24/dunia
Shavkat Mirziyoyev Diproyeksi Menang Lagi di Pemilu Uzbekistan,dunia,tempo.co,https://www.tempo.co/indeks/2021-10-24/dunia
Namibia Hentikan Sementara Vaksin Virus Corona Sputnik V ,dunia,tempo.co,https://www.tempo.co/indeks/2021-10-24/dunia
Kementerian Luar Negeri Pulangkan 13 ABK WNI ,dunia,tempo.co,https://www.tempo.co/indeks/2021-10-24/dunia
7 Jenazah Tahanan di Penjara Penitenciaria del Litoral Ekuador Ditemukan ,dunia,tempo.co,https://www.tempo.co/indeks/2021-10-24/dunia
"Gempa Bumi di Taiwan, Tidak Ada Kerusakan ",dunia,tempo.co,https://www.tempo.co/indeks/2021-10-24/dunia
Pemain Piano Terkenal di China Ditangkap Polisi karena Sewa PSK,dunia,tempo.co,https://www.tempo.co/indeks/2021-10-24/dunia
"Selain Rusia, Kasus Covid-19 di Jerman Capai Rekor Tertinggi",dunia,tempo.co,https://www.tempo.co/indeks/2021-10-24/dunia
Gembong Narkoba Terbesar Setelah Pablo Escobar Ditangkap Militer Kolombia,dunia,tempo.co,https://www.tempo.co/indeks/2021-10-24/dunia
"Jasad Kekasih Selebgram Gabby Petito Dimakan Buaya, Tubuhnya Berceceran",dunia,tempo.co,https://www.tempo.co/indeks/2021-10-24/dunia
"Ribuan Tentara Berkumpul di Myanmar Utara, PBB Khawatir Kekejaman Massal",dunia,tempo.co,https://www.tempo.co/indeks/2021-10-24/dunia
"Penjara Nigeria Diserang Kelompok Bersenjata, 800 Narapidana Dilepaskan",dunia,tempo.co,https://www.tempo.co/indeks/2021-10-24/dunia
"Kotoran Manusia Jatuh dari Pesawat, Guyur Kebun dan Petani di Inggris",dunia,tempo.co,https://www.tempo.co/indeks/2021-10-24/dunia
"Turis Indonesia Bisa Masuk ke Singapura, Apa Saja Syaratnya? ",dunia,tempo.co,https://www.tempo.co/indeks/2021-10-24/dunia
Austria Akan Legalkan Euthanasia,dunia,tempo.co,https://www.tempo.co/indeks/2021-10-24/dunia
Erdogan Usir 10 Dubes Barat karena Tuntut Pembebasan Osman Kavala,dunia,tempo.co,https://www.tempo.co/indeks/2021-10-24/dunia
Top 3 Dunia: Kronologi Tewasnya Gabby Petito sampai Pistol Alec Baldwin,dunia,tempo.co,https://www.tempo.co/indeks/2021-10-24/dunia
"Bom Meledak di Uganda, Dua Orang Tewas",dunia,tempo.co,https://www.tempo.co/indeks/2021-10-24/dunia
"10 Dubes Nyatakan Tak Campuri Urusan Internal Turki, Erdogan Melunak?",dunia,tempo.co,https://www.tempo.co/indeks/2021-10-25/dunia
"Usai Tangkap Perdana Menteri, Militer Umumkan Keadaan Darurat di Sudan",dunia,tempo.co,https://www.tempo.co/indeks/2021-10-25/dunia
"Maskapai Bangkrut, Pramugari di Italia Protes Hanya Pakai Baju Dalam",dunia,tempo.co,https://www.tempo.co/indeks/2021-10-25/dunia
Pria Tak Dikenal Tembak Mati Imam Masjid di Afghanistan,dunia,tempo.co,https://www.tempo.co/indeks/2021-10-25/dunia
"Konselor Amerika Serikat Bertemu Menlu, Perkuat Kemitraan Strategis dengan RI",dunia,tempo.co,https://www.tempo.co/indeks/2021-10-25/dunia
Eks Intelijen Arab Saudi Sebut Anak-anaknya Ditahan Pangeran Bin Salman,dunia,tempo.co,https://www.tempo.co/indeks/2021-10-25/dunia
"Infeksi Covid-19 di Eropa Timur Tembus 20 Juta Kasus, Vaksinasi Corona Minim",dunia,tempo.co,https://www.tempo.co/indeks/2021-10-25/dunia
Stasiun TV Tak Sengaja Tayangkan Video Porno Saat Ramalan Cuaca,dunia,tempo.co,https://www.tempo.co/indeks/2021-10-25/dunia
"Profil Le Corbusier, Nama Arsitektur Legendaris Melekat pada Deddy Corbuzier",dunia,tempo.co,https://www.tempo.co/indeks/2021-10-25/dunia
AS Suntikkan Vaksin Covid-19 untuk Anak 5-11 Tahun Mulai November,dunia,tempo.co,https://www.tempo.co/indeks/2021-10-25/dunia
Pistol Alec Baldwin Sempat Digunakan Kru Sebelum Halyna Hutchins Tertembak,dunia,tempo.co,https://www.tempo.co/indeks/2021-10-25/dunia
"Fakta Tentang Otoniel, Raja Narkoba Paling Berbahaya Setelah Pablo Escobar",dunia,tempo.co,https://www.tempo.co/indeks/2021-10-25/dunia
Perdana Menteri Sudan Ditahan Usai Rumah Dikepung Militer,dunia,tempo.co,https://www.tempo.co/indeks/2021-10-25/dunia
Israel Lanjutkan Proyek Permukiman Ilegal di Tepi Barat Palestina,dunia,tempo.co,https://www.tempo.co/indeks/2021-10-25/dunia
"Selain Pantai Bikini, di Arab Saudi Juga Ada Kafe Khusus Anjing",dunia,tempo.co,https://www.tempo.co/indeks/2021-10-25/dunia
Gubernur Iran Ditampar Saat Pidato,dunia,tempo.co,https://www.tempo.co/indeks/2021-10-25/dunia
Swedia dan Pakistan Peringatkan Afghanistan Akan Segera Runtuh,dunia,tempo.co,https://www.tempo.co/indeks/2021-10-25/dunia
Kolombia Akan Ekstradisi Raja Narkoba Otoniel ke Amerika Serikat,dunia,tempo.co,https://www.tempo.co/indeks/2021-10-25/dunia
Ya Kun Kaya Toast di Cina Dihujat Netizen,dunia,tempo.co,https://www.tempo.co/indeks/2021-10-25/dunia
Oposisi Sebut Pengusiran Duta Besar Sebagai Taktik Erdogan Alihkan Isu Ekonomi,dunia,tempo.co,https://www.tempo.co/indeks/2021-10-25/dunia
Malaysia Akan Izinkan Masuk Pekerja Migran,dunia,tempo.co,https://www.tempo.co/indeks/2021-10-25/dunia
Top 3 Dunia: Temuan Jenazah Pacar Gabby Petito dan Turki Usir Duta Besar,dunia,tempo.co,https://www.tempo.co/indeks/2021-10-25/dunia
"Akun Instagram KBRI Beijing Diretas, Semua Unggahan Dihapus ",dunia,tempo.co,https://www.tempo.co/indeks/2021-10-26/dunia
"Covid-19 di China Masih Tinggi, Kasus Infeksi Flu Burung pada Manusia Ikut Naik",dunia,tempo.co,https://www.tempo.co/indeks/2021-10-26/dunia
Ketika Ajakan Menentang Kudeta Sudan Diserukan dari Pengeras Masjid ,dunia,tempo.co,https://www.tempo.co/indeks/2021-10-26/dunia
"Joe Biden Akan Kucurkan Rp1,4 Triliun untuk Kemitraan dengan Blok ASEAN",dunia,tempo.co,https://www.tempo.co/indeks/2021-10-26/dunia
Joe Biden Akan Ikut Pertemuan Virtual KTT ASEAN,dunia,tempo.co,https://www.tempo.co/indeks/2021-10-26/dunia
Lonjakan Infeksi Flu Burung Di Cina Dikhawatirkan Membuat Virus Bermutasi,dunia,tempo.co,https://www.tempo.co/indeks/2021-10-26/dunia
Penasihat Keamanan AS Temui Pemerintah Bayangan Myanmar,dunia,tempo.co,https://www.tempo.co/indeks/2021-10-26/dunia
KTT ASEAN Dimulai Tanpa Perwakilan dari Myanmar,dunia,tempo.co,https://www.tempo.co/indeks/2021-10-26/dunia
Uni Afrika Berencana Beli 110 Juta Vaksin Covid-19 dari Moderna,dunia,tempo.co,https://www.tempo.co/indeks/2021-10-26/dunia
Bos Samsung Didenda Rp851 Juta karena Gunakan Obat Bius Ilegal,dunia,tempo.co,https://www.tempo.co/indeks/2021-10-26/dunia
PBB Ingatkan Afghanistan Nyaris Hancur: Anak-anak Akan Mati Kelaparan,dunia,tempo.co,https://www.tempo.co/indeks/2021-10-26/dunia
"Peminat PNS Cina Naik, Ada 2 Juta Pendaftar Tahun Ini",dunia,tempo.co,https://www.tempo.co/indeks/2021-10-26/dunia
"Roh Tae-woo Meninggal, Tokoh Reformasi Korsel yang Divonis Korupsi",dunia,tempo.co,https://www.tempo.co/indeks/2021-10-26/dunia
Putri Mako dan Kei Komuro Akhirnya Menikah,dunia,tempo.co,https://www.tempo.co/indeks/2021-10-26/dunia
"Kudeta Militer di Sudan, AS Hentikan Bantuan Rp 9,9 Triliun",dunia,tempo.co,https://www.tempo.co/indeks/2021-10-26/dunia
4 Polisi dan Tentara Terkena Ledakan setelah Demo Pendukung Junta Myanmar,dunia,tempo.co,https://www.tempo.co/indeks/2021-10-26/dunia
Eks Intel Sebut Putra Mahkota Arab Saudi Ingin Bunuh Raja Pakai Cincin Beracun,dunia,tempo.co,https://www.tempo.co/indeks/2021-10-26/dunia
"Presiden Brasil Kaitkan Vaksin Covid dengan AIDS, Videonya Dihapus Youtube",dunia,tempo.co,https://www.tempo.co/indeks/2021-10-26/dunia
Mesir Cabut Status Darurat sejak Pengeboman Gereja 2017,dunia,tempo.co,https://www.tempo.co/indeks/2021-10-26/dunia
"Pulau Kinmen, Saksi Bisu Pertempuran Taiwan Lawan Cina 1958 ",dunia,tempo.co,https://www.tempo.co/indeks/2021-10-26/dunia
"Identik dengan Hantu, Dari Mana Datangnya Perayaan Halloween?",dunia,tempo.co,https://www.tempo.co/indeks/2021-10-26/dunia
7 Tewas dan Ratusan Cedera  dalam Demo Tolak Kudeta Militer di Sudan,dunia,tempo.co,https://www.tempo.co/indeks/2021-10-26/dunia
Selebgram Tewas Terjebak Baku Tembak Geng Narkoba Saat Liburan di Meksiko,dunia,tempo.co,https://www.tempo.co/indeks/2021-10-26/dunia
Erdogan Batal Usir 10 Dubes Barat,dunia,tempo.co,https://www.tempo.co/indeks/2021-10-26/dunia
"Presiden Wanita Pertama di Dunia, Isabel Peron Berikut Drama Kehidupannya",dunia,tempo.co,https://www.tempo.co/indeks/2021-10-26/dunia
18 Jamaah Salat Subuh Tewas dalam Serangan di Masjid Nigeria,dunia,tempo.co,https://www.tempo.co/indeks/2021-10-26/dunia
"Top 3 Dunia: Fakta Raja Narkoba Kolombia, Iklan Ya Kun Kaya Toast Dihujat ",dunia,tempo.co,https://www.tempo.co/indeks/2021-10-26/dunia
Jokowi Berharap Rivalitas Kekuatan Besar di Asia Timur Diakhiri,dunia,tempo.co,https://www.tempo.co/indeks/2021-10-27/dunia
Mantan Perdana Menteri Lebanon Gugat Negara,dunia,tempo.co,https://www.tempo.co/indeks/2021-10-27/dunia
Taiwan Tak Mau Konflik dengan Cina ,dunia,tempo.co,https://www.tempo.co/indeks/2021-10-27/dunia
"Baru 24 Tahun Ibu Muda Ini Sudah Punya 21 Bayi, Gaji Pengasuh Rp 1,4 Miliar",dunia,tempo.co,https://www.tempo.co/indeks/2021-10-27/dunia
Komisi Senat Setuju Presiden Brasil Dijerat Pidana dalam Tangani Pandemi Covid ,dunia,tempo.co,https://www.tempo.co/indeks/2021-10-27/dunia
"Diminta Dokter Istirahat, Ratu Elizabeth II Tak Hadiri KTT COP26 ",dunia,tempo.co,https://www.tempo.co/indeks/2021-10-27/dunia
Guru anti-Junta Myanmar Tewas Diberondong Pria Tak Dikenal,dunia,tempo.co,https://www.tempo.co/indeks/2021-10-27/dunia
Selandia Baru Donasi 684 Ribu Vaksin Virus Corona ke Indonesia ,dunia,tempo.co,https://www.tempo.co/indeks/2021-10-27/dunia
Mahathir Kritik Malaysia Ekspor Listrik dari Energi Tak Terbarukan ke Singapura,dunia,tempo.co,https://www.tempo.co/indeks/2021-10-27/dunia
Saksi Hidup Bom Atom Hiroshima Meninggal di Usia 96 Tahun,dunia,tempo.co,https://www.tempo.co/indeks/2021-10-27/dunia
Joe Biden Hadir di KTT AS-ASEAN ,dunia,tempo.co,https://www.tempo.co/indeks/2021-10-27/dunia
Panglima Hadi Tjahjanto Dapat Penghargaan dari Australia  ,dunia,tempo.co,https://www.tempo.co/indeks/2021-10-27/dunia
PBB: 2 Persen Harta Elon Musk Bisa Atasi Kelaparan di Dunia,dunia,tempo.co,https://www.tempo.co/indeks/2021-10-27/dunia
"Aung San Suu Kyi Hadapi 11 Dakwaan, dari Soal Walkie Talkie sampai anti-Junta",dunia,tempo.co,https://www.tempo.co/indeks/2021-10-27/dunia
Anggota DPR AS Surati Biden Agar Tidak Jual F-16 ke Turki,dunia,tempo.co,https://www.tempo.co/indeks/2021-10-27/dunia
"Sedih, Orangtua di Afghanistan Jual Bayi Rp 7 Juta Agar Bisa Makan",dunia,tempo.co,https://www.tempo.co/indeks/2021-10-27/dunia
"Geng Preman Haiti Blokir Pasokan BBM, Tuntut PM Mundur",dunia,tempo.co,https://www.tempo.co/indeks/2021-10-27/dunia
Politikus Wanita Denmark Bikin Heboh Unggah Foto Berbusana Minim ,dunia,tempo.co,https://www.tempo.co/indeks/2021-10-27/dunia
"Australia Izinkan Warganya ke Luar Negeri, Peluang Besar untuk Wisata Bali?",dunia,tempo.co,https://www.tempo.co/indeks/2021-10-27/dunia
"ISIS Bangkit Lagi Serang Desa di Irak, 11 Orang Warga Sipil Tewas",dunia,tempo.co,https://www.tempo.co/indeks/2021-10-27/dunia
China dan Pakistan Kompak Desak Dunia Kirim Bantuan ke Afghanistan,dunia,tempo.co,https://www.tempo.co/indeks/2021-10-27/dunia
PM Sudan Abdalla Hamdok Dibebaskan Tentara Setelah Ditahan Sehari,dunia,tempo.co,https://www.tempo.co/indeks/2021-10-27/dunia
"Iklan Google Naik, Upaya Pengguna Hindari Pelacakan Perilaku Gagal?",dunia,tempo.co,https://www.tempo.co/indeks/2021-10-27/dunia
Boneka Younghee dalam Serial Squid Game Dipajang di Taman Kota Seoul,dunia,tempo.co,https://www.tempo.co/indeks/2021-10-27/dunia
China Lockdown 4 Juta Orang di Kota Lanzhou Akibat Kasus Corona Naik Lagi,dunia,tempo.co,https://www.tempo.co/indeks/2021-10-27/dunia
Turis Australia dan Swiss Bebas Masuk ke Singapura Tanpa Karantina,dunia,tempo.co,https://www.tempo.co/indeks/2021-10-27/dunia
Warga Jepang Unjuk Rasa Tolak Pernikahan Putri Mako dengan Rakyat Biasa,dunia,tempo.co,https://www.tempo.co/indeks/2021-10-27/dunia
Rumah Sakit Anak Afghanistan Kekurangan Staf Akut,dunia,tempo.co,https://www.tempo.co/indeks/2021-10-27/dunia
Top 3 Dunia: Pulau Bekas Pertempuran Taiwan - Cina dan Erdogan Batal Usir Dubes,dunia,tempo.co,https://www.tempo.co/indeks/2021-10-27/dunia
"Ikon Labu Simbol Perayaan Halloween, Sebelumnya Lobak",dunia,tempo.co,https://www.tempo.co/indeks/2021-10-27/dunia
"Kematian Akibat Covid-19 di Rusia Naik, Aturan Diperketat ",dunia,tempo.co,https://www.tempo.co/indeks/2021-10-28/dunia
"HUT ke-76, PBB Ingatkan Lagi Prinsip di Piagam PBB ",dunia,tempo.co,https://www.tempo.co/indeks/2021-10-28/dunia
Penelitian Terbaru: Antidepresan Rp60 Ribu Bisa Kurangi Keparahan Covid-19,dunia,tempo.co,https://www.tempo.co/indeks/2021-10-28/dunia
Kasus Virus Corona di Jerman Naik,dunia,tempo.co,https://www.tempo.co/indeks/2021-10-28/dunia
"Terinspirasi ISIS, 5 Laki-laki di Jerman Diduga Rencanakan Aksi Teror",dunia,tempo.co,https://www.tempo.co/indeks/2021-10-28/dunia
Selandia Baru Longgarkan Aturan untuk Yang Sudah Vaksin Virus Corona   ,dunia,tempo.co,https://www.tempo.co/indeks/2021-10-28/dunia
"Polisi Laos Menyita 1,5 Ton Kristal Amphetamine",dunia,tempo.co,https://www.tempo.co/indeks/2021-10-28/dunia
"Warga Australia yang sudah Vaksin Covid-19, Boleh ke Luar Negeri ",dunia,tempo.co,https://www.tempo.co/indeks/2021-10-28/dunia
"Tolak Kudeta Militer, Bank Dunia Hentikan Operasional di Sudan",dunia,tempo.co,https://www.tempo.co/indeks/2021-10-28/dunia
Kudeta Militer Sudan Diprotes Rakyat dan Komunitas Internasional ,dunia,tempo.co,https://www.tempo.co/indeks/2021-10-28/dunia
"Cina Kunci Mongolia akibat Covid-19 Naik, Ribuan Turis Terlantar ",dunia,tempo.co,https://www.tempo.co/indeks/2021-10-28/dunia
Pentagon Sebut ISIS-K di Afghanistan Punya Kemampuan Serang AS dalam 6 Bulan,dunia,tempo.co,https://www.tempo.co/indeks/2021-10-28/dunia
"Covid-19 di Singapura Catat Rekor Tertinggi, Pembatasan Sosial Diperpanjang",dunia,tempo.co,https://www.tempo.co/indeks/2021-10-28/dunia
Amerika Serikat Keluarkan Paspor dengan Penanda Gender X untuk Non-biner,dunia,tempo.co,https://www.tempo.co/indeks/2021-10-28/dunia
Pistol yang Dipakai Alec Baldwin Ternyata Tidak Diperiksa Secara Menyeluruh,dunia,tempo.co,https://www.tempo.co/indeks/2021-10-28/dunia
"Tiga Wartawan Myanmar Hadapi Dakwaan Terorisme, 53 Jurnalis Ditahan",dunia,tempo.co,https://www.tempo.co/indeks/2021-10-28/dunia
"Di KTT Asia Timur, Joe Biden Sindir Cina soal Provokasi Terhadap Taiwan",dunia,tempo.co,https://www.tempo.co/indeks/2021-10-28/dunia
Jack Ma Jalan-jalan ke Eropa Belajar Teknologi Pertanian,dunia,tempo.co,https://www.tempo.co/indeks/2021-10-28/dunia
"Krisis Afghanistan Memburuk, Taliban Terpaksa Bayar Buruh Pakai Gandum",dunia,tempo.co,https://www.tempo.co/indeks/2021-10-28/dunia
Artefak Curian dari Afrika yang Dipajang di Museum Akan Dikembalikan,dunia,tempo.co,https://www.tempo.co/indeks/2021-10-28/dunia
Perdana Menteri Luksemburg Xavier Bettel Dituduh Plagiat Saat Kerjakan Tesis S2,dunia,tempo.co,https://www.tempo.co/indeks/2021-10-28/dunia
Top 3 Dunia: Pernikahan Putri Mako dan Singapura Buka Pintu untuk Pelancong,dunia,tempo.co,https://www.tempo.co/indeks/2021-10-28/dunia
"Amerika Hingga Belanda, Ini Daftar Negara yang Buka Pintu untuk Turis RI",dunia,tempo.co,https://www.tempo.co/indeks/2021-10-29/dunia
Prabowo Temui Anwar Ibrahim di Sela Kunjungannya di Malaysia,dunia,tempo.co,https://www.tempo.co/indeks/2021-10-29/dunia
"Nasib ART Asal Indonesia di Malaysia, Tak Digaji 12 Tahun Malah Kena Denda",dunia,tempo.co,https://www.tempo.co/indeks/2021-10-29/dunia
China Batalkan Ratusan Penerbangan Gara-gara Corona Naik Lagi,dunia,tempo.co,https://www.tempo.co/indeks/2021-10-29/dunia
Cara Kim Jong Un Atasi Krisis Pangan: Terbitkan Kupon hingga Ternak Angsa Hitam,dunia,tempo.co,https://www.tempo.co/indeks/2021-10-29/dunia
Taliban Minta Uang Bank Sentral Dicairkan: Itu Milik Afghanistan ,dunia,tempo.co,https://www.tempo.co/indeks/2021-10-29/dunia
Mantan Gubernur New York Didakwa Lakukan Pelanggaran Seksual,dunia,tempo.co,https://www.tempo.co/indeks/2021-10-29/dunia
"Pria Ini Unggah Konten Matematika di Situs Dewasa, Ternyata Banyak yang Menonton",dunia,tempo.co,https://www.tempo.co/indeks/2021-10-29/dunia
"Terlibat Pembunuhan Ibunya di Bali, Warga AS Heather Mack Selesai Jalani Hukuman",dunia,tempo.co,https://www.tempo.co/indeks/2021-10-29/dunia
"Haji Umar Mita, Keturunan Samurai ini Penerjemah Alquran Pertama di Jepang",dunia,tempo.co,https://www.tempo.co/indeks/2021-10-29/dunia
Bintang Komedi di Tiktok Bunuh Istri dengan Kejam Gara-gara Cemburu,dunia,tempo.co,https://www.tempo.co/indeks/2021-10-29/dunia
"Pemadam New York Gugat Wajib Vaksinasi Covid-19, Terancam Dirumahkan Tanpa Gaji",dunia,tempo.co,https://www.tempo.co/indeks/2021-10-29/dunia
Temuan Polisi: 9 dari 10 Remaja Putri di Malaysia Kecanduan Seks,dunia,tempo.co,https://www.tempo.co/indeks/2021-10-29/dunia
"Korea Selatan Longgarkan Pembatasan, Meski Kasus Covid-19 Masih Tinggi  ",dunia,tempo.co,https://www.tempo.co/indeks/2021-10-29/dunia
"Lagi, Amerika Serikat Siap Bela Taiwan Jika Diserang China",dunia,tempo.co,https://www.tempo.co/indeks/2021-10-29/dunia
"Agenda KTT G20, Perubahan Iklim dan Absennya Xi Jinping, Putin dan Kishida ",dunia,tempo.co,https://www.tempo.co/indeks/2021-10-29/dunia
Lima Jurnalis Vietnam Dipenjara karena Sebar Konten Anti-Pemerintah,dunia,tempo.co,https://www.tempo.co/indeks/2021-10-29/dunia
"Setelah AS, Jepang Desak Israel Setop Pembangunan Perumahan di Tepi Barat",dunia,tempo.co,https://www.tempo.co/indeks/2021-10-29/dunia
"Malaysia Ciptakan Kondom Unisex untuk Pria dan Wanita, Pertama di Dunia",dunia,tempo.co,https://www.tempo.co/indeks/2021-10-29/dunia
"Tarif Tes PCR Berbagai Negara: Termurah di India, Thailand di Atas Rp 1 Juta",dunia,tempo.co,https://www.tempo.co/indeks/2021-10-29/dunia
Komisi Eropa Hentikan Sementara Pendanaan ke WHO ,dunia,tempo.co,https://www.tempo.co/indeks/2021-10-29/dunia
ASEAN dan Cina Sepakat Tingkatkan Hubungan,dunia,tempo.co,https://www.tempo.co/indeks/2021-10-29/dunia
Top 3 Dunia: Krisis Ekonomi Afghanistan Memburuk dan Mongolia Lockdown ,dunia,tempo.co,https://www.tempo.co/indeks/2021-10-29/dunia
KTT G20 di Roma Minta Produksi Energi Ditingkatkan,dunia,tempo.co,https://www.tempo.co/indeks/2021-10-30/dunia
"Cina Rombak Kabinet, Perwira Anti-teror Jadi Ketua Partai Komunis di Xinjiang ",dunia,tempo.co,https://www.tempo.co/indeks/2021-10-30/dunia
Universal Studios di Beijing Waswas dengan Penularan Covid-19,dunia,tempo.co,https://www.tempo.co/indeks/2021-10-30/dunia
"Jokowi Temui Macron dan Morrison Secara Terpisah, Ini yang Dibahas",dunia,tempo.co,https://www.tempo.co/indeks/2021-10-30/dunia
"KTT G20 Dibuka, Bahas Pandemi, Perubahan Iklim dan Kerja Sama Ekonomi",dunia,tempo.co,https://www.tempo.co/indeks/2021-10-30/dunia
Junta Myanmar Lancarkan Serangan Udara ke Markas Gerilyawan,dunia,tempo.co,https://www.tempo.co/indeks/2021-10-30/dunia
Taliban Menunjuk Duta Besar Afghanistan yang Baru untuk Pakistan,dunia,tempo.co,https://www.tempo.co/indeks/2021-10-30/dunia
"Abdullah Hammoud, Calon Kuat Walikota Pertama Keturunan Arab di AS",dunia,tempo.co,https://www.tempo.co/indeks/2021-10-30/dunia
Dokter Minta Ratu Elizabeth II Istirahat Lagi ,dunia,tempo.co,https://www.tempo.co/indeks/2021-10-30/dunia
29 LGBT dari Afghanistan Tiba di Inggris ,dunia,tempo.co,https://www.tempo.co/indeks/2021-10-30/dunia
"Pemilu Jepang Besok, Mampukah LDP Bertahan?",dunia,tempo.co,https://www.tempo.co/indeks/2021-10-30/dunia
"Dugaan Kekerasan Seksual, Perancang Busana Peter Nygard Hadir di Persidangan",dunia,tempo.co,https://www.tempo.co/indeks/2021-10-30/dunia
Pria Rusia Menyamar sebagai Dokter untuk Merawat Neneknya di RS Covid ,dunia,tempo.co,https://www.tempo.co/indeks/2021-10-30/dunia
Intelijen Amerika Serikat Pesimis Asal Usul Virus Corona Terungkap ,dunia,tempo.co,https://www.tempo.co/indeks/2021-10-30/dunia
"Dugaan Pelecehan Seksual, Pangeran Andrew Minta Hakim Batalkan Gugatan",dunia,tempo.co,https://www.tempo.co/indeks/2021-10-30/dunia
"Kudeta, Amerika dan PBB Menekan Militer Sudan",dunia,tempo.co,https://www.tempo.co/indeks/2021-10-30/dunia
Amerika Serikat Sahkan Penggunaan Vaksin Virus Corona untuk Anak,dunia,tempo.co,https://www.tempo.co/indeks/2021-10-30/dunia
"Perbudakan Masih Ada di Mali, PBB: Pelakunya Orang Berpengaruh",dunia,tempo.co,https://www.tempo.co/indeks/2021-10-30/dunia
Top 3 Dunia: 9 dari 10 Remaja Putri di Malaysia Kecanduan Seks dan Tarif PCR  ,dunia,tempo.co,https://www.tempo.co/indeks/2021-10-30/dunia
Arab Saudi Calonkan Diri Jadi Tuan Rumah Pameran Dunia Expo 2030,dunia,tempo.co,https://www.tempo.co/indeks/2021-10-30/dunia
KTT G20 Setuju Tambah Bantuan Vaksin Covid-19 ke Negara Miskin ,dunia,tempo.co,https://www.tempo.co/indeks/2021-10-31/dunia
"Cuaca Buruk, American Airlines Batalkan Lebih dari Seribu Penerbangan",dunia,tempo.co,https://www.tempo.co/indeks/2021-10-31/dunia
Musisi Bosnia Pasang Mesin Pembayaran Kartu Bank untuk Tip Tanpa Uang Tunai,dunia,tempo.co,https://www.tempo.co/indeks/2021-10-31/dunia
Arab Saudi Usir Dubes dan Larang Impor Lebanon karena Komentar Menteri ,dunia,tempo.co,https://www.tempo.co/indeks/2021-10-31/dunia
Erupsi Gunung Cumbre Vieja Jadi Tontonan Turis di Musim Liburan,dunia,tempo.co,https://www.tempo.co/indeks/2021-10-31/dunia
Amerika Serikat dan Uni Eropa Sepakat Akhiri Perang Tarif Baja Era Donald Trump,dunia,tempo.co,https://www.tempo.co/indeks/2021-10-31/dunia
Heather Stefanson Jadi PM Perempuan Pertama Provinsi Manitoba Kanada,dunia,tempo.co,https://www.tempo.co/indeks/2021-10-31/dunia
"Sangkal Rumor Kematian, Pemimpin Tertinggi Taliban Dikabarkan Muncul di Publik",dunia,tempo.co,https://www.tempo.co/indeks/2021-10-31/dunia
"Batasi Pemanasan Global, Selandia Baru Janji Pangkas 50 Persen Gas Rumah Kaca",dunia,tempo.co,https://www.tempo.co/indeks/2021-10-31/dunia
Mantan Pegawai IMF Sebut Argentina Tak Mau Membayar Utang  ,dunia,tempo.co,https://www.tempo.co/indeks/2021-10-31/dunia
"Ladang Dilanda Kekeringan, Petani Turki Salahkan Perubahan Iklim ",dunia,tempo.co,https://www.tempo.co/indeks/2021-10-31/dunia
KBRI Beirut Promosi Budaya Indonesia di Nations Day Festival,dunia,tempo.co,https://www.tempo.co/indeks/2021-10-31/dunia
KTT G20 di Roma Diwarnai Unjuk Rasa,dunia,tempo.co,https://www.tempo.co/indeks/2021-10-31/dunia
Macron Unggah Status FB dalam Bahasa Indonesia setelah Bertemu Jokowi,dunia,tempo.co,https://www.tempo.co/indeks/2021-10-31/dunia
Duta Besar Australia Kunjungan ke Sulawesi Selatan,dunia,tempo.co,https://www.tempo.co/indeks/2021-10-31/dunia
"Taliban Minta Pengakuan Dunia, Jika Tidak ...",dunia,tempo.co,https://www.tempo.co/indeks/2021-10-31/dunia
Anak-anak yang Ingin ke Amerika Tak Perlu Lagi Karantina ,dunia,tempo.co,https://www.tempo.co/indeks/2021-10-31/dunia
Alasan Halloween Identik dengan Permen dan Labu,dunia,tempo.co,https://www.tempo.co/indeks/2021-10-31/dunia
