judul,kategori,source,date
Pengunjuk Rasa Palestina Tewas di Tepi Barat,dunia,tempo.co,https://www.tempo.co/indeks/2021-09-25/dunia
Remaja India Umur 15 Tahun Diperkosa Bergiliran oleh 33 Orang,dunia,tempo.co,https://www.tempo.co/indeks/2021-09-25/dunia
Palestina Beri Waktu Israel 1 Tahun untuk Tinggalkan Yerusalem Timur ,dunia,tempo.co,https://www.tempo.co/indeks/2021-09-25/dunia
AS Tambah Sumbangan Vaksin Covid-19 untuk Indonesia,dunia,tempo.co,https://www.tempo.co/indeks/2021-09-25/dunia
Dukun Pembuat Ramuan Anti-Covid Meninggal karena Virus Corona,dunia,tempo.co,https://www.tempo.co/indeks/2021-09-25/dunia
Misteri Tewasnya Selebgram Gabby Petito: Hilang Setelah Jalan Bersama Pacar ,dunia,tempo.co,https://www.tempo.co/indeks/2021-09-25/dunia
Tentara Prancis Tewas Ditembak Militan Islam di Mali,dunia,tempo.co,https://www.tempo.co/indeks/2021-09-25/dunia
"Taliban Terapkan Hukum Islam, Tangan Pencuri akan Dipotong",dunia,tempo.co,https://www.tempo.co/indeks/2021-09-25/dunia
Empat Orang Dekat Presiden Brasil Positif Corona Termasuk Sang Anak,dunia,tempo.co,https://www.tempo.co/indeks/2021-09-25/dunia
"Quad AS, India, Jepang, Australia Bertemu, Cina: Ditakdirkan Gagal",dunia,tempo.co,https://www.tempo.co/indeks/2021-09-25/dunia
Uni Eropa Ingin Buat Fasilitas Umum Charger Ponsel ,dunia,tempo.co,https://www.tempo.co/indeks/2021-09-25/dunia
"Kemarahan Prancis Belum Reda, Tawaran Mendag Australia Bertemu Ditolak",dunia,tempo.co,https://www.tempo.co/indeks/2021-09-25/dunia
Norwegia Mulai Sabtu Ini Hidup Normal setelah Lockdown 561 Hari,dunia,tempo.co,https://www.tempo.co/indeks/2021-09-25/dunia
Top 3 Dunia: Perkembangan Covid-19 di Amerika dan Kondisi Afghanistan Terkini,dunia,tempo.co,https://www.tempo.co/indeks/2021-09-25/dunia
Mantan Kepala Produsen Minuman Keras di Cina Divonis Penjara Seumur Hidup  ,dunia,tempo.co,https://www.tempo.co/indeks/2021-09-26/dunia
"Warga Inggris Panik Borong BBM, Antrean Mengular di Pompa Bensin ",dunia,tempo.co,https://www.tempo.co/indeks/2021-09-26/dunia
"Norwegia Hidup Normal Lagi, Klub Malam hingga Restoran Beroperasi Penuh",dunia,tempo.co,https://www.tempo.co/indeks/2021-09-26/dunia
"Jadi Diaspora India, Kamala Harris Dipuji Narendra Modi",dunia,tempo.co,https://www.tempo.co/indeks/2021-09-26/dunia
"RS Singapura Ini Kewalahan, Ubah Tempat Parkir Jadi UGD Pasien Covid-19",dunia,tempo.co,https://www.tempo.co/indeks/2021-09-26/dunia
Setidaknya 350.209 Orang Tewas dalam Perang Suriah,dunia,tempo.co,https://www.tempo.co/indeks/2021-09-26/dunia
China Bangun Proyek Lithium di Sulawesi Senilai Hampir Rp 5 Triliun,dunia,tempo.co,https://www.tempo.co/indeks/2021-09-26/dunia
Guru Perempuan di Inggris Tewas Dibunuh ,dunia,tempo.co,https://www.tempo.co/indeks/2021-09-26/dunia
"Selesai Isoman, Presiden Vladimir Putin Liburan Naik Gunung dan Memancing Ikan",dunia,tempo.co,https://www.tempo.co/indeks/2021-09-26/dunia
Israel Tembak Mati Empat Warga Palestina di Tepi Barat ,dunia,tempo.co,https://www.tempo.co/indeks/2021-09-26/dunia
Swiss Gelar Referendum Pernikahan Sesama Jenis Hari Ini,dunia,tempo.co,https://www.tempo.co/indeks/2021-09-26/dunia
India Akan Ekspor 8 Juta Vaksin Covid-19 di Bawah Kemitraan Quad,dunia,tempo.co,https://www.tempo.co/indeks/2021-09-26/dunia
Dalang Pembantaian 800 Ribu Warga Rwanda Meninggal di Penjara,dunia,tempo.co,https://www.tempo.co/indeks/2021-09-26/dunia
Jaksa Dakwa Perusahaan Listrik karena Picu Kebakaran Hutan California,dunia,tempo.co,https://www.tempo.co/indeks/2021-09-26/dunia
Kasus Harian Covid-19 Korea Selatan Tembus 3.000 Setelah Liburan,dunia,tempo.co,https://www.tempo.co/indeks/2021-09-26/dunia
Kuba Ekspor Vaksin Virus Corona Buatan Sendiri ke Vietnam,dunia,tempo.co,https://www.tempo.co/indeks/2021-09-26/dunia
"Kecelakaan Kereta Amtrak di Montana AS, Tiga Orang Tewas ",dunia,tempo.co,https://www.tempo.co/indeks/2021-09-26/dunia
Sergei Lavrov Benarkan Mali Minta Bantuan Militer ke Swasta,dunia,tempo.co,https://www.tempo.co/indeks/2021-09-26/dunia
"Partai Sayap Kanan Jerman Ditipu, Satu Juta Selebaran Kampanye Gagal Disebar ",dunia,tempo.co,https://www.tempo.co/indeks/2021-09-26/dunia
"Putri Pendiri Huawei Meng Wanzhou Pulang, Dua Warga Kanada Dibebaskan Cina",dunia,tempo.co,https://www.tempo.co/indeks/2021-09-26/dunia
Sudah 2 Hari Kasus Covid-19 di Victoria Australia Tinggi,dunia,tempo.co,https://www.tempo.co/indeks/2021-09-26/dunia
La Palma Tutup Bandara karena Letusan Baru Gunung Berapi Cumbre Vieja,dunia,tempo.co,https://www.tempo.co/indeks/2021-09-26/dunia
Pejabat Senior di Tunisia Mengundurkan Diri Massal,dunia,tempo.co,https://www.tempo.co/indeks/2021-09-26/dunia
Bom Bunuh Diri Al Shabaab Tewaskan Delapan Orang di Ibu Kota Somalia,dunia,tempo.co,https://www.tempo.co/indeks/2021-09-26/dunia
Islandia Menggelar Pemilu Parlemen ,dunia,tempo.co,https://www.tempo.co/indeks/2021-09-26/dunia
Rusia: PBB Belum Mempertimbangkan Pengakuan Terhadap Taliban,dunia,tempo.co,https://www.tempo.co/indeks/2021-09-26/dunia
Taliban Bunuh Empat Penculik dan Gantung Mayatnya di Alun-alun Kota,dunia,tempo.co,https://www.tempo.co/indeks/2021-09-26/dunia
Pernikahan Putri Mako dari Jepang dengan Rakyat Biasa Diumumkan Oktober ,dunia,tempo.co,https://www.tempo.co/indeks/2021-09-26/dunia
Top 3 Dunia: Studi soal Vaksin Covid-19 hingga Gertakan Palestina ke Israel ,dunia,tempo.co,https://www.tempo.co/indeks/2021-09-26/dunia
"Setelah Ditampar, Kini Presiden Prancis Dilempar Telur",dunia,tempo.co,https://www.tempo.co/indeks/2021-09-27/dunia
Pfizer Uji Coba Obat Oral Lawan Infeksi Covid-19,dunia,tempo.co,https://www.tempo.co/indeks/2021-09-27/dunia
China Klaim Pembebasan Anak Pendiri Huawei karena Kekuatan Mereka  ,dunia,tempo.co,https://www.tempo.co/indeks/2021-09-27/dunia
Malaysia Batasi Jumlah Pekerja Migran Hanya 15 Persen,dunia,tempo.co,https://www.tempo.co/indeks/2021-09-27/dunia
"Polwan Bekas Pengawal Suu Kyie Ditahan Junta Myanmar, Dituduh Unggah Hasutan ",dunia,tempo.co,https://www.tempo.co/indeks/2021-09-27/dunia
"Tren Baru di AS, Jasad Manusia Boleh Dijadikan Pupuk Tanaman ",dunia,tempo.co,https://www.tempo.co/indeks/2021-09-27/dunia
"Taliban Larang Cukur Jenggot dan Musik, Langgar Syariat Islam",dunia,tempo.co,https://www.tempo.co/indeks/2021-09-27/dunia
"China Airshow Digelar Mulai Besok, Jet Tempur Canggih Apa Saja yang Muncul?",dunia,tempo.co,https://www.tempo.co/indeks/2021-09-27/dunia
Sydney Longgarkan Pembatasan Mulai Senin,dunia,tempo.co,https://www.tempo.co/indeks/2021-09-27/dunia
Bos Google Sundar Pichai Mengaku Hobi Kriket dan Bangun Siang,dunia,tempo.co,https://www.tempo.co/indeks/2021-09-27/dunia
Desa di China Ini Bayar Pasangan yang Bersedia Punya Anak Rp 7 Juta per Bulan,dunia,tempo.co,https://www.tempo.co/indeks/2021-09-27/dunia
Viral Toyota Hilux di Australia Memotong Tujuh Jalur Ramai Mobil Tanpa Tertabrak,dunia,tempo.co,https://www.tempo.co/indeks/2021-09-27/dunia
Sepertiga Pom Bensin Inggris Kehabisan BBM,dunia,tempo.co,https://www.tempo.co/indeks/2021-09-27/dunia
"WNI di Malaysia Selundupkan Narkoba dalam Karung, Akan Diekspor ke Indonesia",dunia,tempo.co,https://www.tempo.co/indeks/2021-09-27/dunia
Fakta Pemilu Jerman: Siapa yang Menang dan Kalah?,dunia,tempo.co,https://www.tempo.co/indeks/2021-09-27/dunia
"Inilah S-400 Rudal Canggih Rusia, Diminati Turki dan Jadi Perhatian AS",dunia,tempo.co,https://www.tempo.co/indeks/2021-09-27/dunia
Islandia Bakal Punya Parlemen Mayoritas Perempuan Pertama di Eropa,dunia,tempo.co,https://www.tempo.co/indeks/2021-09-27/dunia
"Pandemi Covid-19 Mirip Perang Dunia, Usia Harapan Hidup Jadi Lebih Pendek",dunia,tempo.co,https://www.tempo.co/indeks/2021-09-27/dunia
New York Ganti Nakes yang Belum Divaksin dengan Tentara Garda Nasional,dunia,tempo.co,https://www.tempo.co/indeks/2021-09-27/dunia
Taliban Minta Penerbangan Internasional Afghanistan Dilanjutkan,dunia,tempo.co,https://www.tempo.co/indeks/2021-09-27/dunia
Pasukan Israel Klaim Bunuh Lima Anggota Jaringan Hamas di Tepi Barat,dunia,tempo.co,https://www.tempo.co/indeks/2021-09-27/dunia
Singapura Catat Rekor Kasus Harian Covid-19 dengan 1.939 Penderita,dunia,tempo.co,https://www.tempo.co/indeks/2021-09-27/dunia
Erdogan Tetap Lanjut Beli S-400 Rusia Meski Turki Terancam Sanksi Amerika,dunia,tempo.co,https://www.tempo.co/indeks/2021-09-27/dunia
"Italia: Mustahil Akui Taliban, karena Ada 17 Teroris di Pemerintahannya",dunia,tempo.co,https://www.tempo.co/indeks/2021-09-27/dunia
"Pemilu Jerman: Partai Sosial Demokrat Menang, Konservatif Angela Merkel Tumbang",dunia,tempo.co,https://www.tempo.co/indeks/2021-09-27/dunia
Ribuan Orang di Tunisia Turun Lagi ke Jalan Mendesak Presiden Mundur,dunia,tempo.co,https://www.tempo.co/indeks/2021-09-27/dunia
"Top 3 Dunia: Taliban Gantung Mayat, Putin Liburan Setelah Isoman ",dunia,tempo.co,https://www.tempo.co/indeks/2021-09-27/dunia
Menhan AS Mengaku Terkejut Tentara Afghanistan Meleleh di Depan Taliban,dunia,tempo.co,https://www.tempo.co/indeks/2021-09-28/dunia
IAEA Sebut Kesepakatan AUKUS Mengecoh  ,dunia,tempo.co,https://www.tempo.co/indeks/2021-09-28/dunia
"Terancam Dipenjara, Mantan Presiden Georgia Nekat Pulang ",dunia,tempo.co,https://www.tempo.co/indeks/2021-09-28/dunia
"Sempat Tenang, Gunung Cumbre Vieja Muntahkan Lava Lagi",dunia,tempo.co,https://www.tempo.co/indeks/2021-09-28/dunia
Cina Memperketat Aturan Aborsi ,dunia,tempo.co,https://www.tempo.co/indeks/2021-09-28/dunia
"China Airshow Dibuka, dari Drone Siluman sampai Jet Tempur Pesaing F-35",dunia,tempo.co,https://www.tempo.co/indeks/2021-09-28/dunia
Presiden Moon Jae-in Ingin Larang Konsumsi Daging Anjing di Korea Selatan ,dunia,tempo.co,https://www.tempo.co/indeks/2021-09-28/dunia
"Republik Vanuatu Sering Kritik Indonesia Soal HAM Papua di PBB, Di Mana Vanuatu?",dunia,tempo.co,https://www.tempo.co/indeks/2021-09-28/dunia
"Ledakan di Gothenburg Swedia, 25 Orang Dilarikan ke Rumah Sakit",dunia,tempo.co,https://www.tempo.co/indeks/2021-09-28/dunia
Produsen Mulai Berlomba Uji Coba Obat Oral untuk Mencegah Covid-19,dunia,tempo.co,https://www.tempo.co/indeks/2021-09-28/dunia
"Ada Sinyal Ancaman dari Sindikat Narkoba, Belanda Tingkatkan Keamanan Mark Rutte",dunia,tempo.co,https://www.tempo.co/indeks/2021-09-28/dunia
"Virus Corona, Thailand Siap-siap Longgarkan Aturan ",dunia,tempo.co,https://www.tempo.co/indeks/2021-09-28/dunia
Inggris Siapkan Pengemudi Tank Angkatan Darat untuk Kirim BBM ke Pom Bensin,dunia,tempo.co,https://www.tempo.co/indeks/2021-09-28/dunia
Junta Militer Myanmar Mulai Serangan Udara dan Putuskan Internet,dunia,tempo.co,https://www.tempo.co/indeks/2021-09-28/dunia
Korea Utara Uji Coba Rudal Lagi,dunia,tempo.co,https://www.tempo.co/indeks/2021-09-28/dunia
Putri Mako Akan Kehilangan Pembayaran Rp19 Miliar Jika Nikahi Kei Komuro,dunia,tempo.co,https://www.tempo.co/indeks/2021-09-28/dunia
Kakak Beradik Warga AS Akhirnya Tinggalkan Cina setelah Bos Huawei Dibebaskan,dunia,tempo.co,https://www.tempo.co/indeks/2021-09-28/dunia
Britney Spears Tuding Ayahnya Melewati Batas karena Sadap Teleponnya,dunia,tempo.co,https://www.tempo.co/indeks/2021-09-28/dunia
Amerika Terancam Bakal Hadapi Penutupan Pemerintahan di Tengah Pandemi Covid-19,dunia,tempo.co,https://www.tempo.co/indeks/2021-09-28/dunia
Amerika Sukses Uji Terbang Senjata Hipersonik Buatan Raytheon,dunia,tempo.co,https://www.tempo.co/indeks/2021-09-28/dunia
Kisah Putri Mako dan Ancaman Menyusutnya Jumlah Keluarga Kekaisaran Jepang,dunia,tempo.co,https://www.tempo.co/indeks/2021-09-28/dunia
Amerika Kucurkan Rp27 T untuk Ganti Peralatan Huawei dari Jaringan Nasional,dunia,tempo.co,https://www.tempo.co/indeks/2021-09-28/dunia
Meng Wanzhou Dibahas dalam Percakapan Telepon Joe Biden dan Xi Jinping,dunia,tempo.co,https://www.tempo.co/indeks/2021-09-28/dunia
Aktivis HAM Desak Dewan HAM PBB Selidiki Kejahatan Perang Taliban,dunia,tempo.co,https://www.tempo.co/indeks/2021-09-28/dunia
Menteri Singapura Prediksi Covid-19 Tembus 5.000 Kasus Baru per Hari ,dunia,tempo.co,https://www.tempo.co/indeks/2021-09-28/dunia
Thailand Hapus Keharusan Karantina bagi Turis yang Sudah Divaksin,dunia,tempo.co,https://www.tempo.co/indeks/2021-09-28/dunia
Gunung Berapi di La Palma Kembali Muntahkan Lava,dunia,tempo.co,https://www.tempo.co/indeks/2021-09-28/dunia
"Target Hidup Normal Akhir Oktober, Korea Vaksinasi Remaja dan Booster Lansia",dunia,tempo.co,https://www.tempo.co/indeks/2021-09-28/dunia
"Ad5, Vaksin Covid-19 Buatan Cina Ini Diklaim Aman untuk Anak 6 Tahun",dunia,tempo.co,https://www.tempo.co/indeks/2021-09-28/dunia
"Top 3 Dunia: Partai Angela Merkel Kalah, China Airshow Digelar Hari Ini ",dunia,tempo.co,https://www.tempo.co/indeks/2021-09-28/dunia
Menkeu Ingatkan AS Kehabisan Uang Bulan Depan Jika Batas Utang Tak Naik,dunia,tempo.co,https://www.tempo.co/indeks/2021-09-29/dunia
"Tragis, Bocah 6 Tahun Tewas di Taman Hiburan Karena Petugas Lupa Pasang Pengaman",dunia,tempo.co,https://www.tempo.co/indeks/2021-09-29/dunia
"20 Staf WHO Diduga Perkosa Gadis-gadis Kongo, Korban Dipecat Bila Menolak",dunia,tempo.co,https://www.tempo.co/indeks/2021-09-29/dunia
"Jenderal Bintang Lima di Dunia Selain Soeharto, Nasution, dan Soedirman",dunia,tempo.co,https://www.tempo.co/indeks/2021-09-29/dunia
"Kasus Covid-19 di Singapura Cetak Rekor, Klaster Baru Ditemukan di Panti Jompo",dunia,tempo.co,https://www.tempo.co/indeks/2021-09-29/dunia
AS Tolak Pesawat Sewaan yang Mengangkut Warga Negaranya dari Afghanistan,dunia,tempo.co,https://www.tempo.co/indeks/2021-09-29/dunia
"Dipecat karena Menolak Vaksinasi Covid-19, Tentara Malaysia Menggugat",dunia,tempo.co,https://www.tempo.co/indeks/2021-09-29/dunia
Manny Pacquiao Tantang Duterte Jadi Capres Filipina: Bel Tinju Sudah Berakhir  ,dunia,tempo.co,https://www.tempo.co/indeks/2021-09-29/dunia
Fumio Kishida Terpilih Sebagai Perdana Menteri Jepang Gantikan Suga ,dunia,tempo.co,https://www.tempo.co/indeks/2021-09-29/dunia
"Aung San Suu Kyi Terancam Hukuman 2 Tahun, Pembela Sulit Cari Saksi",dunia,tempo.co,https://www.tempo.co/indeks/2021-09-29/dunia
KBRI Islamabad Mengadakan Resepsi HUT RI ke-76  ,dunia,tempo.co,https://www.tempo.co/indeks/2021-09-29/dunia
Pejabat Militer AS: Kegagalan Strategis Sebabkan Taliban Kuasai Afghanistan,dunia,tempo.co,https://www.tempo.co/indeks/2021-09-29/dunia
"Negara di Afrika ini Kaya Tembaga, Tapi Tak Mampu Bayar Utang ke China",dunia,tempo.co,https://www.tempo.co/indeks/2021-09-29/dunia
Arab Saudi Kucurkan Rp 185 Triliun untuk Bangun Tempat Wisata,dunia,tempo.co,https://www.tempo.co/indeks/2021-09-29/dunia
"Krisis BBM di Inggris Berlanjut, PM Johnson: Situasi Membaik",dunia,tempo.co,https://www.tempo.co/indeks/2021-09-29/dunia
Amerika Serikat Ingin Revisi Hukuman Pengedar Kokain,dunia,tempo.co,https://www.tempo.co/indeks/2021-09-29/dunia
Senat AS Periksa Efek Beracun Facebook pada Anak Muda  ,dunia,tempo.co,https://www.tempo.co/indeks/2021-09-29/dunia
Australia Hapus Bantuan Tunai jika Vaksinasi Mencapai 80 Persen,dunia,tempo.co,https://www.tempo.co/indeks/2021-09-29/dunia
Menlu Retno: Indonesia Siap Jadi Pusat Produksi Vaksin Covid-19 Asia Pasifik,dunia,tempo.co,https://www.tempo.co/indeks/2021-09-29/dunia
Maskapai Royal Jordanian Buka Lagi Penerbangan ke Suriah,dunia,tempo.co,https://www.tempo.co/indeks/2021-09-29/dunia
Mereka yang Terasingkan di Negeri Orang usai G30S,dunia,tempo.co,https://www.tempo.co/indeks/2021-09-29/dunia
Greta Thunberg Kesal 30 Tahun Masalah Perubahan Iklim Tak Ada Kemajuan ,dunia,tempo.co,https://www.tempo.co/indeks/2021-09-29/dunia
"Tingkat Vaksinasi 80 Persen, Kenapa Penularan Covid-19 di Singapura Naik? ",dunia,tempo.co,https://www.tempo.co/indeks/2021-09-29/dunia
Hakim di Amerika Serikat Setuju Ekstradisi Mantan Presiden Peru,dunia,tempo.co,https://www.tempo.co/indeks/2021-09-29/dunia
Malaysia Izinkan Pendatang Melakukan Karantina di Rumah,dunia,tempo.co,https://www.tempo.co/indeks/2021-09-29/dunia
Senat Filipina Ajukan RUU Batas Usia Individu Boleh Berhubungan Seksual,dunia,tempo.co,https://www.tempo.co/indeks/2021-09-29/dunia
"Hwasong-8, Rudal Terbaru Korea Utara ",dunia,tempo.co,https://www.tempo.co/indeks/2021-09-29/dunia
"J-16D, Pesawat Tempur Siluman Cina yang Semakin Mematikan",dunia,tempo.co,https://www.tempo.co/indeks/2021-09-29/dunia
"Mengenal Vanuatu, Negara yang Sering Mengkritik Indonesia di Sidang PBB",dunia,tempo.co,https://www.tempo.co/indeks/2021-09-29/dunia
Puluhan Pegawai WHO Terlibat dalam Pelecehan Seksual di Kongo,dunia,tempo.co,https://www.tempo.co/indeks/2021-09-29/dunia
"Kembalinya La Bise, Cipika-Cipiki ala Prancis yang Hilang Saat Pandemi",dunia,tempo.co,https://www.tempo.co/indeks/2021-09-29/dunia
"Jepang Cabut Darurat Covid-19 Besok, Angka Kasus Baru Jadi Seribuan",dunia,tempo.co,https://www.tempo.co/indeks/2021-09-29/dunia
Top 3 Dunia: Meng Wanzhou Bebas hingga Presiden Macron Dilempar Telur ,dunia,tempo.co,https://www.tempo.co/indeks/2021-09-29/dunia
Yair Lapid Kunjungi Bahrain untuk Resmikan Kedutaan Besar Israel,dunia,tempo.co,https://www.tempo.co/indeks/2021-09-30/dunia
Menteri Pertahanan Amerika Waswas dengan Nasib Pilot Afghanistan ,dunia,tempo.co,https://www.tempo.co/indeks/2021-09-30/dunia
Dokter Bedah dan Enam Anggota Keluarganya Dihabisi di Afghanistan ,dunia,tempo.co,https://www.tempo.co/indeks/2021-09-30/dunia
Polisi Inggris Dijatuhi Hukuman Seumur Hidup Atas Pembunuhan Sarah Everard,dunia,tempo.co,https://www.tempo.co/indeks/2021-09-30/dunia
"RS Brasil Ini Diam-diam Beri Ivermectin ke Pasien Tanpa Izin, Dampaknya Fatal",dunia,tempo.co,https://www.tempo.co/indeks/2021-09-30/dunia
Warga Cina Boleh Nonton Langsung Olimpiade Musim Dingin 2022,dunia,tempo.co,https://www.tempo.co/indeks/2021-09-30/dunia
Eks Presiden Prancis Nicolas Sarkozy Divonis Satu Tahun Penjara,dunia,tempo.co,https://www.tempo.co/indeks/2021-09-30/dunia
"Ledakan di Beirut, Saksi Mengaku Dapat Ancaman",dunia,tempo.co,https://www.tempo.co/indeks/2021-09-30/dunia
"Wali Kota London Sering Diteror karena Muslim, Dijaga Polisi 24 Jam per Hari   ",dunia,tempo.co,https://www.tempo.co/indeks/2021-09-30/dunia
YouTube Akan Hapus Unggahan Negatif tentang Semua Vaksin,dunia,tempo.co,https://www.tempo.co/indeks/2021-09-30/dunia
Cina Cemas Jika Filipina Perbarui Kerja Sama Pertahanan dengan Amerika Serikat,dunia,tempo.co,https://www.tempo.co/indeks/2021-09-30/dunia
Paspor Negara Ini Tergolong Paspor Langka di Dunia,dunia,tempo.co,https://www.tempo.co/indeks/2021-09-30/dunia
"Nobar Pertandingan Bola, Kasus Covid-19 di Melbourne Melesat Hingga Pecah Rekor",dunia,tempo.co,https://www.tempo.co/indeks/2021-09-30/dunia
"Sudah Suntik 2 Dosis Vaksin Virus Corona, Pasien Covid-19 di Australia Meninggal",dunia,tempo.co,https://www.tempo.co/indeks/2021-09-30/dunia
Tunisia Tunjuk Perdana Menteri Perempuan Pertama,dunia,tempo.co,https://www.tempo.co/indeks/2021-09-30/dunia
Selandia Baru Sahkan Undang-undang Anti-terorisme yang Baru,dunia,tempo.co,https://www.tempo.co/indeks/2021-09-30/dunia
"Inggris Krisis BBM, Tentara Dikerahkan Jadi Sopir Tanker ",dunia,tempo.co,https://www.tempo.co/indeks/2021-09-30/dunia
"Israel Tewaskan 2 Warga Palestina, Termasuk Seorang Wanita",dunia,tempo.co,https://www.tempo.co/indeks/2021-09-30/dunia
Korban Tewas dalam Kerusuhan di Penjara Ekuador Jadi 116 Orang,dunia,tempo.co,https://www.tempo.co/indeks/2021-09-30/dunia
Adik Kim Jong Un Ditunjuk Jadi Pejabat di Badan Tertinggi Korea Utara,dunia,tempo.co,https://www.tempo.co/indeks/2021-09-30/dunia
"Angka Kemiskinan di Venezuela Tembus 76,6 Persen ",dunia,tempo.co,https://www.tempo.co/indeks/2021-09-30/dunia
"Pangeran Harry Dicap Munafik, Usai Kampanye Lingkungan Pulang Naik Jet Pribadi",dunia,tempo.co,https://www.tempo.co/indeks/2021-09-30/dunia
Tokoh Rohingya Ditembak Mati di Kamp Pengungsi Bangladesh,dunia,tempo.co,https://www.tempo.co/indeks/2021-09-30/dunia
"5 Negara Pemberi Utang Terbanyak ke Amerika Serikat, Siapa Saja?",dunia,tempo.co,https://www.tempo.co/indeks/2021-09-30/dunia
13 Ton Tempe Diekspor ke Jepang,dunia,tempo.co,https://www.tempo.co/indeks/2021-09-30/dunia
Dubes Iwan Hadiahkan Sepeda Bambu pada Presiden Albania,dunia,tempo.co,https://www.tempo.co/indeks/2021-09-30/dunia
"Pelukis Pamerkan Dua Kanvas Kosong di Museum Denmark Seharga Rp 1,2 Miliar",dunia,tempo.co,https://www.tempo.co/indeks/2021-09-30/dunia
Lonjakan Kasus Covid-19 di Malaysia karena Banyak Remaja Terpapar,dunia,tempo.co,https://www.tempo.co/indeks/2021-09-30/dunia
"Drone Cina Pesaing XQ-58A  AS, Secanggih Jet Tempur tapi Lebih Hemat Biaya",dunia,tempo.co,https://www.tempo.co/indeks/2021-09-30/dunia
"Ledakan di Beirut, Warga Marah Investigasi Belum Selesai",dunia,tempo.co,https://www.tempo.co/indeks/2021-09-30/dunia
"Profil Fumio Kishida, dari Menteri Luar Negeri ke Perdana Menteri Jepang  ",dunia,tempo.co,https://www.tempo.co/indeks/2021-09-30/dunia
Laporan Rahasia: Bank Sentral Afghanistan Kehabisan Dolar sebelum Taliban Menang,dunia,tempo.co,https://www.tempo.co/indeks/2021-09-30/dunia
Kim Jong Un Akan Pulihkan Hotline Inter-Korea,dunia,tempo.co,https://www.tempo.co/indeks/2021-09-30/dunia
"Perang antar-Geng di Penjara Ekuador, 100 Narapidana Tewas",dunia,tempo.co,https://www.tempo.co/indeks/2021-09-30/dunia
PRT di Singapura Ludahi dan Isi Botol Minum Majikan dengan Air Toilet,dunia,tempo.co,https://www.tempo.co/indeks/2021-09-30/dunia
"AS Umumkan 23 Spesies Dilindungi Telah Punah, Termasuk Burung Pelatuk ",dunia,tempo.co,https://www.tempo.co/indeks/2021-09-30/dunia
"China Bangun Pusat Karantina Canggih dengan 5.000 Kamar, Pelayannya Robot",dunia,tempo.co,https://www.tempo.co/indeks/2021-09-30/dunia
"Top 3 Dunia: Menhan AS Terkejut Afghanistan Kalah, China Pamer Pesawat Tempur   ",dunia,tempo.co,https://www.tempo.co/indeks/2021-09-30/dunia
Ini Alasan Indonesia Was-Was atas AUKUS dan Kapal Selam Nuklir Australia,dunia,tempo.co,https://www.tempo.co/indeks/2021-10-01/dunia
Duta Besar Tavares Serahkan Surat Kepercayaan ke Presiden Belarus,dunia,tempo.co,https://www.tempo.co/indeks/2021-10-01/dunia
Inggris Krisis Daging Babi Gara-gara Ditinggalkan Imigran Eropa Timur ,dunia,tempo.co,https://www.tempo.co/indeks/2021-10-01/dunia
"Vaksin Sinovac Digunakan Lagi di Malaysia, Kali Ini untuk Anak 12-17 Tahun",dunia,tempo.co,https://www.tempo.co/indeks/2021-10-01/dunia
ISIS Diduga Bisa Bangkit Lagi di Afghanistan dalam 36 Bulan,dunia,tempo.co,https://www.tempo.co/indeks/2021-10-01/dunia
7 Pejabat PBB Diusir dari Ethiopia karena Dituduh Ikut Campur,dunia,tempo.co,https://www.tempo.co/indeks/2021-10-01/dunia
Covid-19 Memperparah Kemiskinan di Argetina ,dunia,tempo.co,https://www.tempo.co/indeks/2021-10-01/dunia
"9 Tewas Saat Rumah Sakit Covid-19 di Rumania Terbakar, Ketiga dalam Setahun Ini",dunia,tempo.co,https://www.tempo.co/indeks/2021-10-01/dunia
Jihad Buttu Perempuan Palestina Raih Gelar Sarjana Hukum Islam di Usia 85 Tahun,dunia,tempo.co,https://www.tempo.co/indeks/2021-10-01/dunia
"Australia Buka Perbatasan, Penerbangan Internasional Beroperasi Lagi November   ",dunia,tempo.co,https://www.tempo.co/indeks/2021-10-01/dunia
Murid Sekolah Dasar di Prancis Tak Lagi Wajib Pakai Masker,dunia,tempo.co,https://www.tempo.co/indeks/2021-10-01/dunia
Lembaga Amal Kesulitan Bantu Evakuasi Warga Afghanistan,dunia,tempo.co,https://www.tempo.co/indeks/2021-10-01/dunia
Putri Mako Jepang Nikahi Kekasihnya yang Rakyat Biasa Pada 26 Oktober,dunia,tempo.co,https://www.tempo.co/indeks/2021-10-01/dunia
"Kekurangan Sopir, 2 Ribu Pom Bensin di Inggris Kehabisan Bahan Bakar",dunia,tempo.co,https://www.tempo.co/indeks/2021-10-01/dunia
"Ketentuan Baru di Malaysia, Warga Divaksin Lengkap Bisa Makan di Restoran",dunia,tempo.co,https://www.tempo.co/indeks/2021-10-01/dunia
"Vaksin Moderna di Jepang Tercemar Logam, Takeda Akhirnya Buka Suara Penyebabnya",dunia,tempo.co,https://www.tempo.co/indeks/2021-10-01/dunia
Senat Amerika Serikat Minta Facebook Lindungi Pengguna Muda,dunia,tempo.co,https://www.tempo.co/indeks/2021-10-01/dunia
"Diperingati Setiap 1 Oktober, Begini Sejarah Hari Kopi Internasional",dunia,tempo.co,https://www.tempo.co/indeks/2021-10-01/dunia
Afrika Selatan Longgarkan Aturan Pencegahan Covid-19 Sampai Level 1,dunia,tempo.co,https://www.tempo.co/indeks/2021-10-01/dunia
PBB dan Amerika Serikat Mengutuk Pembunuhan Pemimpin Etnis Rohingya,dunia,tempo.co,https://www.tempo.co/indeks/2021-10-01/dunia
Amerika Serikat Tanggapi Uji Coba Rudal Korea Utara,dunia,tempo.co,https://www.tempo.co/indeks/2021-10-01/dunia
Polisi di Ekuador Mengidentifikasi 116 Korban Kerusuhan di Penjara,dunia,tempo.co,https://www.tempo.co/indeks/2021-10-01/dunia
Status Darurat Covid-19 di Prancis Kemungkinan Diperpanjang Sampai 2022,dunia,tempo.co,https://www.tempo.co/indeks/2021-10-01/dunia
Timnas Muda Sepak Bola Perempuan Afghanistan Dapat Suaka di Portugal,dunia,tempo.co,https://www.tempo.co/indeks/2021-10-01/dunia
Rusia Akan Gelar Pernikahan Anggota Keluarga Kerajaan Pertama dalam Satu Abad,dunia,tempo.co,https://www.tempo.co/indeks/2021-10-01/dunia
"Sempat Kabur, Wanita Berusia 96 Tahun Diadili dalam Kasus Nazi",dunia,tempo.co,https://www.tempo.co/indeks/2021-10-01/dunia
Top 3 Dunia: Penerima Vaksin di Australia Meninggal dan Negara Pemberi Utang AS,dunia,tempo.co,https://www.tempo.co/indeks/2021-10-01/dunia
Warga Qatar Pertama Kalinya Beri Suara dalam Pemilihan Parlemen,dunia,tempo.co,https://www.tempo.co/indeks/2021-10-02/dunia
Cerita Murid Perempuan Menunggu Janji Taliban Membuka Kembali Sekolah,dunia,tempo.co,https://www.tempo.co/indeks/2021-10-02/dunia
"Menteri Utama NSW Berejiklian Mundur, sedang Diselidiki Komisi anti-Korupsi",dunia,tempo.co,https://www.tempo.co/indeks/2021-10-02/dunia
Malaysia Ingin Beli Obat Covid-19 Buatan Merck ,dunia,tempo.co,https://www.tempo.co/indeks/2021-10-02/dunia
WNI dan Warga Malaysia Peringati Hari Batik di Kuala Lumpur,dunia,tempo.co,https://www.tempo.co/indeks/2021-10-02/dunia
